Author,Body,Created Time,Id,Parent_id,Permalink,Score,Sentiment
CyndaquilTyphlosion,"Newton's laws are very much applicable. Trust me, i hate Elon, but how will you propel the rocket forward? With rockets, you burn gases which become very hot and exert high pressure and this shoot out the back, carrying away as much momentum back as is imparted forward onto the rocket. How would you do that with an electrical system?",2023-01-08 12:33:26,j3glzdx,t1_j3gfrij,/r/WhitePeopleTwitter/comments/106ah0w/behold_my_friends_the_brightest_mind_to_ever/j3glzdx/,9,Positive
SaltySwallowsYuck,One could argue that he was saying the weight of the electric storage would out weigh the thrust it could produce. I would argue that's not 3rd law but storage technology issue but whatever.,2023-01-08 16:53:54,j3hiaqv,t1_j3gfrij,/r/WhitePeopleTwitter/comments/106ah0w/behold_my_friends_the_brightest_mind_to_ever/j3hiaqv/,2,Neutral
Landonian,"What do you mean it isn’t applicable to this situation? Rocket science is basically founded on Newton’s third law. I’m no fan of Elon, but he’s pretty much correct on this one. 

Electric cars are not as bounded by Newton’s third law because they can push off the ground (still very much uses Newton’s third law).

The only way you can make a rocket accelerate in space, a vacuum, is by propelling something in the opposite direction, basically the essence of Newton’s third law.

You getting this many upvotes is depressing.",2023-01-08 20:39:04,j3ij12j,t1_j3gfrij,/r/WhitePeopleTwitter/comments/106ah0w/behold_my_friends_the_brightest_mind_to_ever/j3ij12j/,2,Positive
Pheerful,Newton's third law is a key concept of how rockets even work. I swear to god elon could tweet that water is wet and redditors would try to figure out a way to prove him wrong. Can we all agree that hes a dumbass without having to deny the most basic principles of science to try to dunk on his fucking tweets?,2023-01-08 16:14:07,j3hcb8w,t1_j3gfrij,/r/WhitePeopleTwitter/comments/106ah0w/behold_my_friends_the_brightest_mind_to_ever/j3hcb8w/,1,Negative
Taoistandroid,"In what world is it not applicable?

https://www.grc.nasa.gov/www/k-12/rocket/newton3r.html#:~:text=His%20third%20law%20states%20that,are%20exerted%20on%20different%20objects.

I get that people don't like Elon ( I don't like Elon) but it feels like everyone is throwing out all reason in trying to find issue in anything he says (of late).",2023-01-08 16:17:47,j3hcuqj,t1_j3gfrij,/r/WhitePeopleTwitter/comments/106ah0w/behold_my_friends_the_brightest_mind_to_ever/j3hcuqj/,1,Negative
Fit_Cash8904,Exactly. There’s a totally legitimate case to be made that electric rockets aren’t practical or feasible. But saying you can’t because of a Newtonian law is basically likening it to perpetual motion.,2023-01-08 22:43:12,j3j3ace,t1_j3gfrij,/r/WhitePeopleTwitter/comments/106ah0w/behold_my_friends_the_brightest_mind_to_ever/j3j3ace/,0,Positive
_Oman,"Newton's third law doesn't prevent anything. It says that there will always be an opposite and equal reaction. His statement implies there could never be a thing called a rocket, electrical, chemical, or otherwise.

He thinks he is super smart, and he might actually understand the unique challenges in creating an electrically vs. chemically driven rocket, but he isn't smart enough to squeeze that into a tweet.",2023-01-08 19:38:24,j3i8zg8,t1_j3gfrij,/r/WhitePeopleTwitter/comments/106ah0w/behold_my_friends_the_brightest_mind_to_ever/j3i8zg8/,-1,Positive
everynameisused100,"Nah we have gravity on earth, space has no gravity.",2023-01-08 17:02:30,j3hjnr8,t1_j3gfrij,/r/WhitePeopleTwitter/comments/106ah0w/behold_my_friends_the_brightest_mind_to_ever/j3hjnr8/,1,Neutral
CryonautX,"Newton's third law is a major part of what makes rocket science so difficult. It's definitely a lot more relevant to discuss Newton's third law for a rocket compared to a car. This is because rockets have a very difficult task of moving in space which is a vacuum. A car has an easy time moving because it applies a force to the ground and the ground pushes back, moving the car forward. 

Rockets are in a vacuum, they have nothing in their environment to apply a force to which also means there is nothing to apply a force to the rocket and  move it. So they have to bring things to push with them, the reaction mass. Rockets are essentially giant fuel tanks. How they move in space is by burning the fuel and pushing all the mass the rocket brought with it out and the reaction mass will in return push the rocket forward.  So you can see how replacing this reaction mass with electricity can be tricky. But with all that said, we already have solar powered ion thrusters that are commonly used for small positioning adjustments in space. They basically push out ions rather than burning fuel to get the pushback. Making an ion thruster powerful enough to launch a rocket out of Earth is however inconceivable today. Ion thrusters also need a vacuum to work so that's another challenge.

There are other ideas that can be explored like having a spacecraft with a sail attached and you move the spacecraft with a laser from earth pushing the sail. This would however technically not be a rocket.

So to address what Elon said, he is technically wrong in that ion thrusters are electric rockets and already exist. But at the same time, I feel he might be answering the question: can an electric powered vehicle enter Orbit from earth? Answer to that as far as we can tell so far is no. Because we don't have a good way to get strong thrust without a mass source in a vacuum regardless of how much energy you hold in the form of electricity.",2023-01-08 18:40:34,j3hzgay,t1_j3gfrij,/r/WhitePeopleTwitter/comments/106ah0w/behold_my_friends_the_brightest_mind_to_ever/j3hzgay/,1,Positive
Gdjica,"He was asked the question exactly because his company makes electric cars. It is not a good comparison because there is no air in space, no ground, no nothing to push against like a car does. No need to escape the gravity, either.

electric ion propulsion would be a better own but it would still need some propellant so still not (fully) electrical

the man is most likely not wrong",2023-01-08 19:29:47,j3i7l0c,t1_j3gfrij,/r/WhitePeopleTwitter/comments/106ah0w/behold_my_friends_the_brightest_mind_to_ever/j3i7l0c/,1,Positive
theonewhoknocksforu,"Of course it’s important, but the question is, how can you create thrust with an electric power source. Existing rocket engines are burning highly reactive fuels to create thrust. Electric powered engines need to create thrust by using some form of electrostatic or electromagnetic force, or by creating a stream of charged particles, like an ion thruster. These are all approaches that NASA is current using for deep space systems, but they aren’t practical yet for earth to space engines. They will be eventually.

Elon’s comment just reinforces the fact that he is a huckster who doesn’t understand physics.",2023-01-08 23:09:54,j3j7f7c,t1_j3gfrij,/r/WhitePeopleTwitter/comments/106ah0w/behold_my_friends_the_brightest_mind_to_ever/j3j7f7c/,1,Positive
PomegranateOld7836,"It's incredibly semantic. If an electric plane flew a neutron thruster rocket to a high altitude, does that count as a launch?",2023-01-08 23:23:07,j3j9gaj,t1_j3gfrij,/r/WhitePeopleTwitter/comments/106ah0w/behold_my_friends_the_brightest_mind_to_ever/j3j9gaj/,1,Positive
OccultWitchHunt,Careful now. Elon's gonna buy reddit and he'll ban you for making sense.,2023-01-08 17:45:38,j3hqh01,t1_j3gfrij,/r/WhitePeopleTwitter/comments/106ah0w/behold_my_friends_the_brightest_mind_to_ever/j3hqh01/,0,Negative
Global_Charming,Nice one,2023-01-08 16:00:57,j3haee7,t1_j3haavs,/r/WhitePeopleTwitter/comments/106ah0w/behold_my_friends_the_brightest_mind_to_ever/j3haee7/,1,Positive
Catatonic27,Batteries also weigh the same when they're dead vs charged unlike a fuel tank,2023-01-08 12:25:29,j3glbi2,t1_j3gd4t2,/r/WhitePeopleTwitter/comments/106ah0w/behold_my_friends_the_brightest_mind_to_ever/j3glbi2/,83,Negative
takishan,"There are certain [limits on energy density due to physics.](https://electronics.stackexchange.com/questions/4328/whats-the-highest-theoretical-energy-density-for-a-chemical-battery)

The speculative upper limit according to that poster is 5,200wh/kg. [Energy density of hydrogen](https://rmi.org/run-on-less-with-hydrogen-fuel-cells/) is 120 MJ/kg or 33,333 wh/kg. So even if we increased current battery efficiency ( about 260-270 wh/kg) by two factors of magnitude it still can't compete with plain old hydrogen.




Having said that... we can't ignore that the energy density of hydrogen alone is meaningless without oxygen because it needs that to burn and create thrust in a rocket. Someone smarter than me can do the math, but from what I understand you need 1 part oxygen for every 2 parts oxygen.",2023-01-08 17:15:42,j3hlr2o,t1_j3gefaj,/r/WhitePeopleTwitter/comments/106ah0w/behold_my_friends_the_brightest_mind_to_ever/j3hlr2o/,4,Negative
Fit_Lawfulness_3147,That’s what she said,2023-01-08 16:27:32,j3heaha,t1_j3gefaj,/r/WhitePeopleTwitter/comments/106ah0w/behold_my_friends_the_brightest_mind_to_ever/j3heaha/,1,Neutral
NotYetiFamous,"railgun orbit. Wouldn't technically be a rocket, I think, but for unmanned things it'd work nicely. Since you'd have to cram all the acceleration into whatever magnetic rail length to get you to space it isn't likely a person could survive it unless it's a really, really long rail. Right now we extend that acceleration out over basically the entire trip.",2023-01-08 12:32:53,j3glxrk,t1_j3gl0dr,/r/WhitePeopleTwitter/comments/106ah0w/behold_my_friends_the_brightest_mind_to_ever/j3glxrk/,4,Positive
OneWithMath,"It is impossible to put something into a stable orbit around a body with only a cannon-like single acceleration event from the surface. It would either fall back to earth or reach escape velocity and orbit the sun.

Now you might be able to do something clever to reduce the amount of fuel required to reach orbit, but can't rely on only a rail gun (unless the tracks were so long as to cause the acceleration profile to no longer be approximately instantaneous).",2023-01-08 15:11:56,j3h3go6,t1_j3gl0dr,/r/WhitePeopleTwitter/comments/106ah0w/behold_my_friends_the_brightest_mind_to_ever/j3h3go6/,4,Negative
Milk_Effect,Then build it another way around. Put a railgun on a rocket and shoot mass in opposite direction.,2023-01-08 17:20:04,j3hmfpn,t1_j3hawwu,/r/WhitePeopleTwitter/comments/106ah0w/behold_my_friends_the_brightest_mind_to_ever/j3hmfpn/,17,Neutral
Elro0003,"Have the rail gun be attached to the rocket, that way it'd fit the definition",2023-01-08 17:56:42,j3hs7ue,t1_j3hawwu,/r/WhitePeopleTwitter/comments/106ah0w/behold_my_friends_the_brightest_mind_to_ever/j3hs7ue/,2,Positive
LouisACook,Also if fast enough to actually reach space it would  likely squish anything made of meat before the projectile was released.,2023-01-08 17:59:55,j3hsqhz,t1_j3hawwu,/r/WhitePeopleTwitter/comments/106ah0w/behold_my_friends_the_brightest_mind_to_ever/j3hsqhz/,2,Positive
iamyourliter,So you’re proving Elon right then,2023-01-09 01:59:56,j3jwn30,t1_j3hawwu,/r/WhitePeopleTwitter/comments/106ah0w/behold_my_friends_the_brightest_mind_to_ever/j3jwn30/,1,Positive
Top-Reply-4408,I think it's technically a missile at that point.,2023-01-08 16:58:43,j3hj21w,t1_j3hdxch,/r/WhitePeopleTwitter/comments/106ah0w/behold_my_friends_the_brightest_mind_to_ever/j3hj21w/,-1,Neutral
Mr-IT-Guy,"What if we wrote ""Rocket"" on the side of it?",2023-01-08 18:20:30,j3hw3gt,t1_j3hdxch,/r/WhitePeopleTwitter/comments/106ah0w/behold_my_friends_the_brightest_mind_to_ever/j3hw3gt/,-1,Neutral
PickleRicksFunHouse,"They're right, technically not a rocket, but a [genius way to reach orbit.](https://www.spinlaunch.com/)",2023-01-08 16:58:03,j3hiye4,t1_j3hbn64,/r/WhitePeopleTwitter/comments/106ah0w/behold_my_friends_the_brightest_mind_to_ever/j3hiye4/,1,Positive
THOMASTHEWANKENG1NE,And an electric engine is just a motor.   Calling something an electric rocket doesn't mean it has to be direct thrust.,2023-01-08 18:23:18,j3hwk72,t1_j3hj6v5,/r/WhitePeopleTwitter/comments/106ah0w/behold_my_friends_the_brightest_mind_to_ever/j3hwk72/,1,Negative
bendeboy,"Holy crap, that's awesome!",2023-01-08 17:28:13,j3hnqmh,t1_j3hcmj9,/r/WhitePeopleTwitter/comments/106ah0w/behold_my_friends_the_brightest_mind_to_ever/j3hnqmh/,6,Positive
Nerodon,"> This exists.

Don't hold your breath, it's a proposed idea but it's never yet thrown something to orbit.

Spinlaunch is as real as Elon's hyperloop. May work in theory but has plenty of problems in practice.",2023-01-08 18:19:49,j3hvzdr,t1_j3hcmj9,/r/WhitePeopleTwitter/comments/106ah0w/behold_my_friends_the_brightest_mind_to_ever/j3hvzdr/,3,Positive
SirRoadpie,"If they develop this sufficiently then I don't see a reason that an entirely electric space craft isn't possible. 

We might not be able to do it yet, but I can see the foundation. And if we figure out how to make a space elevator then even better imo.",2023-01-08 20:46:08,j3ik84x,t1_j3hcmj9,/r/WhitePeopleTwitter/comments/106ah0w/behold_my_friends_the_brightest_mind_to_ever/j3ik84x/,2,Positive
thisismenow1989,Yote*,2023-01-08 16:37:29,j3hfs8u,t1_j3hdvrb,/r/WhitePeopleTwitter/comments/106ah0w/behold_my_friends_the_brightest_mind_to_ever/j3hfs8u/,24,Neutral
caillouuu,Do you taste pork?? No you taste figs!,2023-01-08 15:49:35,j3h8rcr,t1_j3gvcqz,/r/WhitePeopleTwitter/comments/106ah0w/behold_my_friends_the_brightest_mind_to_ever/j3h8rcr/,65,Neutral
UniqueNameWithAPun,"Does it taste like a pork cookie, motherfucker?!",2023-01-08 16:23:31,j3hdp1e,t1_j3h084g,/r/WhitePeopleTwitter/comments/106ah0w/behold_my_friends_the_brightest_mind_to_ever/j3hdp1e/,38,Neutral
smokefrog2,Jimmy neutron,2023-01-08 13:54:27,j3gtuua,t1_j3gtqay,/r/WhitePeopleTwitter/comments/106ah0w/behold_my_friends_the_brightest_mind_to_ever/j3gtuua/,37,Neutral
Earlybirdsgetworms,"Ponies are assholes, they bite all the time.",2023-01-08 20:23:06,j3igcl9,t1_j3h6o51,/r/WhitePeopleTwitter/comments/106ah0w/behold_my_friends_the_brightest_mind_to_ever/j3igcl9/,3,Neutral
HanakusoDays,"No, but he's a master of the donkey punch.",2023-01-08 20:20:10,j3ifuzh,t1_j3h6o51,/r/WhitePeopleTwitter/comments/106ah0w/behold_my_friends_the_brightest_mind_to_ever/j3ifuzh/,1,Neutral
Aaron_Hungwell,"No Fig Newton Slaw, please.",2023-01-08 13:44:51,j3gstft,t1_j3gldo4,/r/WhitePeopleTwitter/comments/106ah0w/behold_my_friends_the_brightest_mind_to_ever/j3gstft/,20,Neutral
Andrelliina,I know fig law,2023-01-08 13:15:07,j3gpshd,t1_j3gldo4,/r/WhitePeopleTwitter/comments/106ah0w/behold_my_friends_the_brightest_mind_to_ever/j3gpshd/,8,Neutral
TheCrimsonDagger,No. The only praiseworthy thing Elon has done is being willing to throw tons of money into a developing industry at a time when other ultra wealthy individuals weren’t. It has nothing to with being smart but rather risk tolerance. It’s also a lot easier to take big risks when your parents own an emerald mine.,2023-01-08 07:27:51,j3fy41j,t1_j3fuxqe,/r/WhitePeopleTwitter/comments/106ah0w/behold_my_friends_the_brightest_mind_to_ever/j3fy41j/,1398,Positive
Lady_von_Stinkbeaver,"Multiple SpaceX employees have said the key to the company's success is a team that keeps Elon too distracted to ""improve"" things.",2023-01-08 13:10:17,j3gpby8,t1_j3fuxqe,/r/WhitePeopleTwitter/comments/106ah0w/behold_my_friends_the_brightest_mind_to_ever/j3gpby8/,179,Positive
SwillMcRando,"No. This is why the Space-X Elon Distraction Department urged him to buy Twitter*. If he is busy exploding a social media company, he won't be in their way and they can finally get some shit done.

*This is just my working hypothesis.",2023-01-08 08:20:35,j3g2e65,t1_j3fuxqe,/r/WhitePeopleTwitter/comments/106ah0w/behold_my_friends_the_brightest_mind_to_ever/j3g2e65/,112,Negative
Hold-the-Bus2604,He is just a modern-day Thomas Edison. Bank rolling other peoples ideas and hard work & taking credit for it,2023-01-08 13:09:52,j3gpail,t1_j3fuxqe,/r/WhitePeopleTwitter/comments/106ah0w/behold_my_friends_the_brightest_mind_to_ever/j3gpail/,18,Negative
DaEnderAssassin,"No.

SpaceXs ""Technoking"" (Apparently his actual position according to legal documents) is just surrounded by people who can manipulate him into doing what they want him to do. It's why Twitter is burning, it doesn't have this layer between the company and elongated muskrat",2023-01-08 10:39:05,j3gcz4z,t1_j3fuxqe,/r/WhitePeopleTwitter/comments/106ah0w/behold_my_friends_the_brightest_mind_to_ever/j3gcz4z/,32,Positive
Mael_Jade,"He created dozens of jobs at SpaceX! Twelve people are employed to keep him happy and away from anything tech related. 

And another twelve people to make him think any smart idea came from him.

And yet another twelve work to undo any ideas he presents.",2023-01-08 13:57:42,j3gu84c,t1_j3fuxqe,/r/WhitePeopleTwitter/comments/106ah0w/behold_my_friends_the_brightest_mind_to_ever/j3gu84c/,2,Positive
main_motors,"He used to give Jeffrey Epstien personal tours there, back in 2012",2023-01-08 14:07:22,j3gvbu8,t1_j3fuxqe,/r/WhitePeopleTwitter/comments/106ah0w/behold_my_friends_the_brightest_mind_to_ever/j3gvbu8/,2,Neutral
The_First_Drop,"I can’t source this so it’s entirely conjecture, but I read a twitter thread from an ex-SpaceX employee a couple of months ago that claimed there was a concerted effort at the company to distract Elon from whatever they were working on",2023-01-08 14:41:15,j3gzgmp,t1_j3fuxqe,/r/WhitePeopleTwitter/comments/106ah0w/behold_my_friends_the_brightest_mind_to_ever/j3gzgmp/,2,Neutral
Life-Significance-33,Didn't he get called out for breeding with his employees ar space x?,2023-01-08 13:48:13,j3gt6ad,t1_j3fuxqe,/r/WhitePeopleTwitter/comments/106ah0w/behold_my_friends_the_brightest_mind_to_ever/j3gt6ad/,1,Neutral
OilComprehensive6237,He inhibits and harasses the employees https://www.ibtimes.co.uk/no-one-likes-working-elon-musk-claims-supposed-spacex-employee-1481559,2023-01-08 15:19:58,j3h4k8n,t1_j3fuxqe,/r/WhitePeopleTwitter/comments/106ah0w/behold_my_friends_the_brightest_mind_to_ever/j3h4k8n/,1,Neutral
Iwamoto,I believe he's not even on the board of directors at Space X,2023-01-08 13:22:48,j3gqjzf,t1_j3fuxqe,/r/WhitePeopleTwitter/comments/106ah0w/behold_my_friends_the_brightest_mind_to_ever/j3gqjzf/,-1,Neutral
Scrub_LordOfFlorida,This guys gives cool complementary brain aneurysms,2023-01-08 15:10:43,j3h3anh,t1_j3fuxqe,/r/WhitePeopleTwitter/comments/106ah0w/behold_my_friends_the_brightest_mind_to_ever/j3h3anh/,0,Positive
ptvlm,"From what I've heard, he's useful for hype and gathering funding, but they slowly lure him away with the intellectual equivalent of dog treats from anything resembling engineering decisions. Which means he thinks he made the decisions but the people doing the actual work wouldn't accept one made with his input.",2023-01-08 15:15:47,j3h3zfn,t1_j3fuxqe,/r/WhitePeopleTwitter/comments/106ah0w/behold_my_friends_the_brightest_mind_to_ever/j3h3zfn/,0,Positive
satisfried,Sure!  He uses the data he has collected on Tesla-driving politicians and big wigs to ensure space-X gets all the contracts to launch his telecom satellites into orbit so he can then get more data on more people.,2023-01-08 15:22:25,j3h4wg6,t1_j3fuxqe,/r/WhitePeopleTwitter/comments/106ah0w/behold_my_friends_the_brightest_mind_to_ever/j3h4wg6/,0,Positive
LivejournalRefugee,">does this man even do anything

No.",2023-01-08 15:28:07,j3h5oui,t1_j3fuxqe,/r/WhitePeopleTwitter/comments/106ah0w/behold_my_friends_the_brightest_mind_to_ever/j3h5oui/,0,Neutral
EdZeppelin94,He gets in the way,2023-01-08 15:33:55,j3h6ijt,t1_j3fuxqe,/r/WhitePeopleTwitter/comments/106ah0w/behold_my_friends_the_brightest_mind_to_ever/j3h6ijt/,0,Neutral
schizoballistic,He's basically trust fund flava flav,2023-01-08 15:36:16,j3h6uh4,t1_j3fuxqe,/r/WhitePeopleTwitter/comments/106ah0w/behold_my_friends_the_brightest_mind_to_ever/j3h6uh4/,0,Neutral
TheGrandExquisitor,"He causes problems. People there spend a large amount of time doing ""Elon Herding.""",2023-01-08 15:53:27,j3h9b8d,t1_j3fuxqe,/r/WhitePeopleTwitter/comments/106ah0w/behold_my_friends_the_brightest_mind_to_ever/j3h9b8d/,0,Positive
ta112233,This man is “CEO” of three super high profile companies at the same time. He clearly doesn’t do anything at any of them. All he does is shitpost.,2023-01-08 15:57:06,j3h9u9b,t1_j3fuxqe,/r/WhitePeopleTwitter/comments/106ah0w/behold_my_friends_the_brightest_mind_to_ever/j3h9u9b/,0,Positive
mark-haus,"No, he buys stuff. End of story. He doesn’t engineer, one look at his hyper loop white paper should confirm that to any engineer or really any person with a reasonably good understanding of physics. He’s a marketer and person who owns stuff. That’s it. It’s just more blatantly obvious than usual that his successes are entirely due to the people he hires and takes credit from",2023-01-08 16:30:57,j3hesr4,t1_j3fuxqe,/r/WhitePeopleTwitter/comments/106ah0w/behold_my_friends_the_brightest_mind_to_ever/j3hesr4/,0,Positive
silly_frog_lf,Which is why they can launch rockets in the first place,2023-01-08 16:32:41,j3hf25g,t1_j3fuxqe,/r/WhitePeopleTwitter/comments/106ah0w/behold_my_friends_the_brightest_mind_to_ever/j3hf25g/,0,Positive
RheaButt,It's an open secret that much of the management at SpaceX works specifically to stop musk from ever being involved in anything,2023-01-08 17:34:28,j3hoq0f,t1_j3fuxqe,/r/WhitePeopleTwitter/comments/106ah0w/behold_my_friends_the_brightest_mind_to_ever/j3hoq0f/,0,Negative
celerydonut,"He likes to pretend to, same way donald pretended to run a country. It’s all about the visuals. I really wish we as a society could start boosting each other up instead of sharing what a handful of wealthy dildo’s fart out and think every minute. The less attention we give them the quicker they will fizzle out. Who. Fucking. Cares.",2023-01-08 23:19:42,j3j8xit,t1_j3fuxqe,/r/WhitePeopleTwitter/comments/106ah0w/behold_my_friends_the_brightest_mind_to_ever/j3j8xit/,0,Negative
pacific_beach,Of course he does - who else is going to sexually assault the flight attendants?,2023-01-08 23:33:57,j3jb4c2,t1_j3fuxqe,/r/WhitePeopleTwitter/comments/106ah0w/behold_my_friends_the_brightest_mind_to_ever/j3jb4c2/,0,Positive
hauntedbutt,Glass onion was clearly about Elon.,2023-01-09 01:37:37,j3jth0n,t1_j3fuxqe,/r/WhitePeopleTwitter/comments/106ah0w/behold_my_friends_the_brightest_mind_to_ever/j3jth0n/,0,Positive
prezuiwf,"This is all great info, but by invoking Newton's Third Law he is clearly asserting it's physically impossible, not just that the technology doesn't currently exist.",2023-01-08 15:31:36,j3h66p4,t1_j3gwkqz,/r/WhitePeopleTwitter/comments/106ah0w/behold_my_friends_the_brightest_mind_to_ever/j3h66p4/,121,Positive
L0renzoVonMatterhorn,"As a fellow aerospace engineer who agrees with you, it’s weird how many aerospace engineers are suddenly in this comment section talking about rail guns and the like. 

As if Elon wasn’t obviously talking about rockets designed to get our current thinking of payload, manned or unmanned, the deltaV for at least LEO. 

Sure, ion thrusters exist. Sure, rail guns are getting closer to escape velocity (for relatively small projectiles). We even have solar sails - those are basically electric propulsion right? 🙄 

Everyone’s a fucking scientist when they hate a person.",2023-01-08 16:32:25,j3hf0p2,t1_j3gwkqz,/r/WhitePeopleTwitter/comments/106ah0w/behold_my_friends_the_brightest_mind_to_ever/j3hf0p2/,2,Negative
Buznik6906,"As a layperson I'm curious what an aerospace engineer would have to say about a space elevator, if the logistics were sorted out such that they could get a stable platform way out there with a cable running up to it would we be able to use electric solutions to get things to and fro?

I imagine at that point it doesn't count as a rocket any more though.",2023-01-08 16:44:46,j3hgw6y,t1_j3gwkqz,/r/WhitePeopleTwitter/comments/106ah0w/behold_my_friends_the_brightest_mind_to_ever/j3hgw6y/,1,Positive
LogicalHuman,Thank you!!,2023-01-08 17:27:50,j3hnocs,t1_j3gwkqz,/r/WhitePeopleTwitter/comments/106ah0w/behold_my_friends_the_brightest_mind_to_ever/j3hnocs/,1,Neutral
VocRehabber,We need to convince DARPA that we need those MAC Cannons from Halo to protect Earth from meteors or something,2023-01-08 17:57:41,j3hsdj1,t1_j3gwkqz,/r/WhitePeopleTwitter/comments/106ah0w/behold_my_friends_the_brightest_mind_to_ever/j3hsdj1/,1,Neutral
Dontstopmeenowww,"The question you answered and the replies to you read all like some weird anti Elon version of selfawarewolves.

Rail gun is the only technically feasible way - and even then that’s more of a vessel and less of a rocket. Not to mention that while sufficiently advanced battery technology that could technically achieve this, maybe, in the future as the “so you’re saying there’s a chance” response below yours notes - that there’d like be other purpose designed propulsion systems favored instead.

What the worst part about this is that Reddit throws a fit when you don’t hate Elon with a full heart regardless of context. And I don’t even like the guy but jeeze",2023-01-09 03:54:55,j3kckps,t1_j3gwkqz,/r/WhitePeopleTwitter/comments/106ah0w/behold_my_friends_the_brightest_mind_to_ever/j3kckps/,1,Negative
dittybopper_05H,"Photon rockets are theoretically possible but require unobtanium like perfect reflectors and an extremely high output but very low weight energy source.   

Even then, you can’t really use them because essentially you have a giant and dangerous space laser.   You’d have to know where everything of importance is, so you can avoid shining your death beam on it.  That limits the directions you can point it.",2023-01-08 14:18:06,j3gwlg2,t1_j3ggezr,/r/WhitePeopleTwitter/comments/106ah0w/behold_my_friends_the_brightest_mind_to_ever/j3gwlg2/,25,Positive
