Author,Body,Created Time,Id,Parent_id,Permalink,Score,Sentiment
ThomasTServo,Yep. Ion engines. It's how TIE fighters do. It's also the inspiration for the impulse drive in Star Trek.,2023-01-08 15:33:17,j3h6fcs,t1_j3fs7dr,/r/WhitePeopleTwitter/comments/106ah0w/behold_my_friends_the_brightest_mind_to_ever/j3h6fcs/,1,Neutral
FRCP_12b6,"Spacex uses Hall Effect thrusters on starlink.  Clearly he was referring to an engine that isn't using mass as a propellent.  However, this also exists by using solar sails.",2023-01-08 15:36:13,j3h6u8u,t1_j3fs7dr,/r/WhitePeopleTwitter/comments/106ah0w/behold_my_friends_the_brightest_mind_to_ever/j3h6u8u/,1,Positive
TheDoofusNugget,"As much I find Elon Musk to be cringe, to be fair though, Elon could’ve interpreted the question as: “Is a rocket possible with only electricity (no propellant)?” Even “electrical thrusters” require propellant obviously to be propelled. Still a brain fart though for the Spacex CEO oof 🤷‍♀️",2023-01-08 15:41:25,j3h7l8r,t1_j3fs7dr,/r/WhitePeopleTwitter/comments/106ah0w/behold_my_friends_the_brightest_mind_to_ever/j3h7l8r/,1,Positive
tishpou,Why so much hate for the man?,2023-01-08 15:46:48,j3h8cxp,t1_j3fs7dr,/r/WhitePeopleTwitter/comments/106ah0w/behold_my_friends_the_brightest_mind_to_ever/j3h8cxp/,1,Negative
beemccouch,Just like the dynamic breaks that we're invented in the 60s. The 1860s.,2023-01-08 15:54:47,j3h9i7w,t1_j3fs7dr,/r/WhitePeopleTwitter/comments/106ah0w/behold_my_friends_the_brightest_mind_to_ever/j3h9i7w/,1,Neutral
Speculawyer,You don't get out of planetary gravity wells with that.,2023-01-08 16:02:07,j3hakj9,t1_j3fs7dr,/r/WhitePeopleTwitter/comments/106ah0w/behold_my_friends_the_brightest_mind_to_ever/j3hakj9/,1,Neutral
fruit_meat,"It's still wild to me how often his throat bois refer to him as an ""engineer."" What exactly has the guy personally engineered besides his own image?",2023-01-08 16:04:36,j3haxal,t1_j3fs7dr,/r/WhitePeopleTwitter/comments/106ah0w/behold_my_friends_the_brightest_mind_to_ever/j3haxal/,1,Positive
CricketKingofLocusts,"Are these thrusters strong enough to get out of the atmosphere, though?",2023-01-08 16:04:53,j3hayr3,t1_j3fs7dr,/r/WhitePeopleTwitter/comments/106ah0w/behold_my_friends_the_brightest_mind_to_ever/j3hayr3/,1,Positive
SakuraKiwi,It’s also uses propellant,2023-01-08 16:06:16,j3hb62e,t1_j3fs7dr,/r/WhitePeopleTwitter/comments/106ah0w/behold_my_friends_the_brightest_mind_to_ever/j3hb62e/,1,Neutral
oblex1312,"Somebody call JPL, Elon is about to buy them and delete this article.",2023-01-08 16:14:57,j3hcfpq,t1_j3fs7dr,/r/WhitePeopleTwitter/comments/106ah0w/behold_my_friends_the_brightest_mind_to_ever/j3hcfpq/,1,Neutral
leakypipe,That will never generate enough propulsion to take off.  Elon is pretty much correct.,2023-01-08 16:15:26,j3hcibd,t1_j3fs7dr,/r/WhitePeopleTwitter/comments/106ah0w/behold_my_friends_the_brightest_mind_to_ever/j3hcibd/,1,Positive
gabther,"Is it feasible though? ""Compared to chemical rockets, the thrust is very small, on the order of 83 mN for a typical thruster operating at 300 V and 1.5 kW. For comparison, the weight of a coin like the U.S. quarter or a 20-cent euro coin is approximately 60 mN""",2023-01-08 16:17:55,j3hcveu,t1_j3fs7dr,/r/WhitePeopleTwitter/comments/106ah0w/behold_my_friends_the_brightest_mind_to_ever/j3hcveu/,1,Negative
thehobster1,I mean if they weren't possible then I would have to find a new thesis,2023-01-08 16:19:55,j3hd60n,t1_j3fs7dr,/r/WhitePeopleTwitter/comments/106ah0w/behold_my_friends_the_brightest_mind_to_ever/j3hd60n/,1,Negative
MisterMcArthur,"Pro of this technology:
- Mighty efficient: Ion propulsion always seems to be the go-to propulsion technology for in-orbit adjustment or long distance trips to low gravity bodies. The Ion thruster is also capable of firing for long durations without needing to stop. 
Con of tech:
- slow: the reason why ion thruster fire for long durations is because the force it applies to push the spacecraft is no greater than gravity pushing a sheet of paper down on my hand! So not very strong.

-Not 100% electric : Xenon gas is ionized in order to give energy to the propellant in order to push the spacecraft. Once it’s out of Xenon, its dead

The only two prototypes to not bring their own propellant are sailing ships! ( sails in space! ). And it only works because of the bouncing of photons on a micron-thick reflective sail. It can cause a very small push to the spacecraft and making it able to change its orbit. Of course, if this sailcraft ever gets too far away from the sun, well it can no longer be pushed.

To conclude, I have to disagree with you that you can push a spacecraft to orbit without pushing something else away, it’s just not possible. I can agree that Elon is currently an asshole on the internet though. All in all, this meme sucks lmao get your facts straight Reddit! Jeez!",2023-01-08 16:25:13,j3hdy2c,t1_j3fs7dr,/r/WhitePeopleTwitter/comments/106ah0w/behold_my_friends_the_brightest_mind_to_ever/j3hdy2c/,1,Positive
Tysic,"Lol, an ion drive will never have the thrust to weight ratio high enough to propel a marble into LEO, let alone a spacecraft.  I fucking hate Musk, but this is some top tier Dunning Kruger from Reddit rn.",2023-01-08 16:26:09,j3he2y5,t1_j3fs7dr,/r/WhitePeopleTwitter/comments/106ah0w/behold_my_friends_the_brightest_mind_to_ever/j3he2y5/,1,Positive
ActuaryRound9882,"Using a hall thruster on a satellite already in space that doesn't need to break orbit is not the same as using it on a rocket to break out of the earth's atmosphere . If you even sort of read the wiki you linked you'd be able to see its used on objects already in space , in a vacuum where there is no air friction to overcome . You can throw something in space and as long as nothing acts on it , it'll go forever , throw the same object towards the sky and it absolutely will fall back down . Using small electric thrusters in space is not the same as using them to break out of orbit .",2023-01-08 16:34:54,j3hfdz1,t1_j3fs7dr,/r/WhitePeopleTwitter/comments/106ah0w/behold_my_friends_the_brightest_mind_to_ever/j3hfdz1/,1,Positive
Duckpoke,He’s implying ground based rockets to orbit. There’s a million things to make fun of him for but this isn’t one. Is it ‘possible’? Maybe. It would never in a million years be practical,2023-01-08 16:35:55,j3hfjko,t1_j3fs7dr,/r/WhitePeopleTwitter/comments/106ah0w/behold_my_friends_the_brightest_mind_to_ever/j3hfjko/,1,Positive
Sparred4Life,Do thrusters count as rockets? They seem like two very different things.,2023-01-08 16:39:01,j3hg0ps,t1_j3fs7dr,/r/WhitePeopleTwitter/comments/106ah0w/behold_my_friends_the_brightest_mind_to_ever/j3hg0ps/,1,Neutral
briedcan,Says at the very beginning that propellant is used. Propellant is not electric. I know you hate the guy but come on.,2023-01-08 16:40:13,j3hg7bb,t1_j3fs7dr,/r/WhitePeopleTwitter/comments/106ah0w/behold_my_friends_the_brightest_mind_to_ever/j3hg7bb/,1,Negative
M13Calvin,He is an idiot. But it is still true that ion drives like this can't create enough thrust to launch a rocket into space from the ground. They're used more for thrust once the vehicle is already in space,2023-01-08 16:41:50,j3hgg8g,t1_j3fs7dr,/r/WhitePeopleTwitter/comments/106ah0w/behold_my_friends_the_brightest_mind_to_ever/j3hgg8g/,1,Positive
BeerEater1,"Are Hall-effect thrusters rockets though?

Isn't a rocket a well-defined concept, not just a word referring to thrusters on space vehicles?

I'm asking this seriously, because I'm tired of people misusing words.",2023-01-08 17:03:33,j3hjtq4,t1_j3fs7dr,/r/WhitePeopleTwitter/comments/106ah0w/behold_my_friends_the_brightest_mind_to_ever/j3hjtq4/,1,Negative
Just_Eirik,"I know this is real and the Epstein drive is fiction, but reading that made me really want to re-read The Expance. Thanks for that :D",2023-01-08 17:11:23,j3hl2j8,t1_j3fs7dr,/r/WhitePeopleTwitter/comments/106ah0w/behold_my_friends_the_brightest_mind_to_ever/j3hl2j8/,1,Positive
slickbandito69,He does have a bachelor of arts degree in physics gitta give credit where it's due,2023-01-08 17:12:34,j3hl9fv,t1_j3fs7dr,/r/WhitePeopleTwitter/comments/106ah0w/behold_my_friends_the_brightest_mind_to_ever/j3hl9fv/,1,Negative
SpecialIcy1809,"But, this is still working by ejecting a material thus projecting the rocket in the opposite directions.
Once the tank is empty you’re going nowhere.
And I believe this is the question.
You need to eject a material in order to go to the opposite direction: no electric only rockets.",2023-01-08 17:16:12,j3hltuw,t1_j3fs7dr,/r/WhitePeopleTwitter/comments/106ah0w/behold_my_friends_the_brightest_mind_to_ever/j3hltuw/,1,Negative
WatARn,"Sorry if this has been said before, but a rocket generally describes a launcher in its entirety, and its payload. You’re talking about a thruster. He’s still wrong though, because the rocket equation is derived from a generalization of Newton’s second law (F=ma, but with varying mass too). The problem with electric thrusters is their propellant effectively has constant weight, and their energetic density is far too low for a rocket. The closest thing to an electric rocket is the Electron, which is more of a hybrid.

The real question to me, is why are there so many bootlicking Elon fanboy accounts disguised as educational content, and why is he interacting with them?",2023-01-08 17:18:29,j3hm6ry,t1_j3fs7dr,/r/WhitePeopleTwitter/comments/106ah0w/behold_my_friends_the_brightest_mind_to_ever/j3hm6ry/,1,Positive
Joekooole,"A satellite sure, but a rocket that launches to orbit using Hall effect or ion engines? Yeah that’s pretty much impossible considering ion engines are incredibly weak, measured in micro newtons compared to the hundreds if not thousands of kilo newtons needed for liftoff of most rockets, which is where chemical propulsion is basically the only answer we have (so far). Each technology serves its purpose well",2023-01-08 17:35:21,j3houyh,t1_j3fs7dr,/r/WhitePeopleTwitter/comments/106ah0w/behold_my_friends_the_brightest_mind_to_ever/j3houyh/,1,Positive
Torvane,"I think the idea was to eliminate the need of a propellant, not just use electricity as an alternative to activating propellant with chemical combustion",2023-01-08 17:53:52,j3hrryl,t1_j3fs7dr,/r/WhitePeopleTwitter/comments/106ah0w/behold_my_friends_the_brightest_mind_to_ever/j3hrryl/,1,Neutral
franco84732,Doesn’t he have a degree in physics from penn? That’s absolutely an “actual” science degree,2023-01-08 18:02:03,j3ht2ng,t1_j3fs7dr,/r/WhitePeopleTwitter/comments/106ah0w/behold_my_friends_the_brightest_mind_to_ever/j3ht2ng/,1,Neutral
Nerodon,"An ION engine uses electricity, but it's not an **electrical engine** it still needs propellant, careful what you say here. Because when someone says electrical engine, I'm thinking EM engine, which doesn't work.",2023-01-08 18:23:15,j3hwjvr,t1_j3fs7dr,/r/WhitePeopleTwitter/comments/106ah0w/behold_my_friends_the_brightest_mind_to_ever/j3hwjvr/,1,Negative
negative_pt,This is my guy and he brings lemonade!!,2023-01-08 18:38:55,j3hz6em,t1_j3fs7dr,/r/WhitePeopleTwitter/comments/106ah0w/behold_my_friends_the_brightest_mind_to_ever/j3hz6em/,1,Neutral
blbrd30,"Uh he just said ""Newton's Third Law"" I think he knows more than u wtf????",2023-01-08 18:39:00,j3hz6x2,t1_j3fs7dr,/r/WhitePeopleTwitter/comments/106ah0w/behold_my_friends_the_brightest_mind_to_ever/j3hz6x2/,1,Neutral
dailycnn,"An electric system could intake and push air to launch a craft from Earth.  This wouldn't work in space.

An  ion drive wouldn't work to launch a craft from Earth because it is orders of magnitude inadquate.  But it would work in space.

So maybe a better answer is, not efficiently enough to replace rocket fuel-based engines.",2023-01-08 18:47:35,j3i0lqq,t1_j3fs7dr,/r/WhitePeopleTwitter/comments/106ah0w/behold_my_friends_the_brightest_mind_to_ever/j3i0lqq/,1,Positive
corona-lime-us,That article sure references “propellant” a lot.,2023-01-08 18:58:11,j3i2dfp,t1_j3fs7dr,/r/WhitePeopleTwitter/comments/106ah0w/behold_my_friends_the_brightest_mind_to_ever/j3i2dfp/,1,Positive
hamsterfolly,Correct,2023-01-08 19:28:41,j3i7ed6,t1_j3fs7dr,/r/WhitePeopleTwitter/comments/106ah0w/behold_my_friends_the_brightest_mind_to_ever/j3i7ed6/,1,Neutral
tehfiend,"Elon can be an idiot but he has a bachelors degree in physics which is probably where he learned that a ""Hall-effect thruster"" uses a propellent which exploits Newton's third law...

#",2023-01-08 19:52:45,j3ibajt,t1_j3fs7dr,/r/WhitePeopleTwitter/comments/106ah0w/behold_my_friends_the_brightest_mind_to_ever/j3ibajt/,1,Negative
LindX31,"I kinda worked on it and no it can’t be used on a rocket. It’s good for satellites in the void where any acceleration is efficient but to escape earth’s atmosphere, we need way more power than Hall effect thrusters will ever provide.",2023-01-08 20:00:15,j3icje2,t1_j3fs7dr,/r/WhitePeopleTwitter/comments/106ah0w/behold_my_friends_the_brightest_mind_to_ever/j3icje2/,1,Positive
Trackman1997,"I would assume that Elon is assuming the question is if it’s possible to build a rocket that doesn’t rely on chemical thrusters, and while the Hall Effect allows for non-chemical thrusters in space, it is infeasible to produce rockets capable of going from ground to space anytime in the near future. Thus why hydrogen, methane, or some other propellant is required for rockets and thus can’t be made “renewable” i.e. electric anytime soon.

Newton’s third law is also technically a reasonable answer, though it doesn’t explain why Hall Thrusters are infeasible, but does explain why all rockets (even Hall Thrusters) require some form of propellant and can’t just be recharged like an electric car, though you need a lot of math to get from Newton’s third law to the rocket equation, plus Newton’s other laws of motion.

There are of course non-rocket ways of getting into space that avoid the rocket equation like space elevators, railguns, skyhooks, orbital rings, and likely more engineering solutions I am unaware of, and those that haven’t been conceived of yet. They are not rockets though. They are not subject to the rocket equation, do not function like a rocket, and if a rocket is like a covered wagon, all those ideas are more akin to roads or railways depending on how complex it is, expensive infrastructure to help get space into orbit. With only the skyhook being realistically plausible today and potentially economically feasible with the amount of material we’re currently throwing up into space.

At the very least calling a rocket that gets into orbit through chemical rockets and then uses the Hall Thruster effect to slowly burn through a supply of xenon, doesn’t feel like it should fit the definition of an ‘electric rocket’ even if it is using electricity to power the second stage.",2023-01-08 20:20:21,j3ifw1s,t1_j3fs7dr,/r/WhitePeopleTwitter/comments/106ah0w/behold_my_friends_the_brightest_mind_to_ever/j3ifw1s/,1,Positive
Asleep_Home_2826,The thrusters you linked to still use propellant which is not stored electricity such as a battery. I would argue that it’s not electric even though its designed to use electromagnetics to throw stuff behind the rocket (NIII) because it’s the propellant that describes the type of rocket.,2023-01-08 20:24:51,j3igmwz,t1_j3fs7dr,/r/WhitePeopleTwitter/comments/106ah0w/behold_my_friends_the_brightest_mind_to_ever/j3igmwz/,1,Negative
bobvonbob,"Yeah, good luck getting into space with that.

I don't like Elon, but we can't use electric rockets.

The way you accelerate is by ejecting mass. Electric propulsion is incapable of ejecting enough mass to overcome gravity.

Once you're in space, they're great, but satellites are NOT rockets.",2023-01-08 21:05:50,j3inl4l,t1_j3fs7dr,/r/WhitePeopleTwitter/comments/106ah0w/behold_my_friends_the_brightest_mind_to_ever/j3inl4l/,1,Positive
radmanmadical,"This doesn’t really qualify if I understand the question - I believe he means electrically powered rocket - not a rocket that uses electricity to generate thrust, if I understand the link you posted there’s no reason this method of propulsion couldn’t be powered by a liquid fuel - etc. It would come down to whether you could store the all energy you needed for your rocket in the form of electrical potential imbalance, not whether your propulsion was electrically driven - but that’s just my interpretation of OP’s prompt…",2023-01-08 21:06:14,j3innna,t1_j3fs7dr,/r/WhitePeopleTwitter/comments/106ah0w/behold_my_friends_the_brightest_mind_to_ever/j3innna/,1,Positive
slackmaster2k,"I dislike Elon as much as the next guy, but feel like we’re freaking out a bit too much over a simple comment.

It’s arguably highly impractical to build an effective electric rocket.  That is a, by definition a rocket that propels itself, and given context, one that launches itself plus a payload from earth into space.

The question itself is a bit of a silly one, and if Elon wasn’t such an ass he could at least give a small explanation.",2023-01-08 21:35:12,j3ishr7,t1_j3fs7dr,/r/WhitePeopleTwitter/comments/106ah0w/behold_my_friends_the_brightest_mind_to_ever/j3ishr7/,1,Positive
bcstrong03,Elon Musk is definitely very stupid.,2023-01-08 21:55:33,j3ivtbu,t1_j3fs7dr,/r/WhitePeopleTwitter/comments/106ah0w/behold_my_friends_the_brightest_mind_to_ever/j3ivtbu/,1,Negative
ScrotiusRex,"I wouldn't call a hall thruster an electric rocket. 

They do actually consume fuel.",2023-01-08 22:10:07,j3iy4k9,t1_j3fs7dr,/r/WhitePeopleTwitter/comments/106ah0w/behold_my_friends_the_brightest_mind_to_ever/j3iy4k9/,1,Neutral
not_a_lady_tonight,Elon isn’t the brightest bulb in the batch. Great thing he’s spreading his genes around.,2023-01-08 07:36:23,j3fyt1f,t1_j3fkzmk,/r/WhitePeopleTwitter/comments/106ah0w/behold_my_friends_the_brightest_mind_to_ever/j3fyt1f/,126,Positive
barbara_jay,Musk is the Jordan Peterson of science,2023-01-08 06:28:35,j3fswcb,t1_j3frt7o,/r/WhitePeopleTwitter/comments/106ah0w/behold_my_friends_the_brightest_mind_to_ever/j3fswcb/,286,Neutral
tilehinge,"""**No!** It's *just* ***DUMB!""***",2023-01-08 13:46:06,j3gsy65,t1_j3frt7o,/r/WhitePeopleTwitter/comments/106ah0w/behold_my_friends_the_brightest_mind_to_ever/j3gsy65/,8,Negative
Lithl,"Hall-effect thrusters are a form of electric rocketry that has been used in practical operation since 1971.

Starlink satellites use Hall-effect thrusters for station keeping and deorbiting.

_This man owns a company with electric rockets and thinks electric rockets are physically impossible_.",2023-01-08 12:16:43,j3gkl5j,t1_j3frt7o,/r/WhitePeopleTwitter/comments/106ah0w/behold_my_friends_the_brightest_mind_to_ever/j3gkl5j/,58,Negative
MyBallsAreOnFir3,He's got money and now has one of the largest social media platforms at his disposal. Kinda hard to ignore the stupid shit he says.,2023-01-08 20:04:32,j3id9io,t1_j3frt7o,/r/WhitePeopleTwitter/comments/106ah0w/behold_my_friends_the_brightest_mind_to_ever/j3id9io/,2,Negative
Frictionizer,It’s becoming more and more apparent that he’s the guy from Glass Onion,2023-01-08 15:54:27,j3h9gha,t1_j3frt7o,/r/WhitePeopleTwitter/comments/106ah0w/behold_my_friends_the_brightest_mind_to_ever/j3h9gha/,3,Positive
lashapel,If they stop listening to him  this sub would be desperate for content,2023-01-08 14:40:10,j3gzbqr,t1_j3frt7o,/r/WhitePeopleTwitter/comments/106ah0w/behold_my_friends_the_brightest_mind_to_ever/j3gzbqr/,1,Negative
nikhil48,"You need a propellant. Something that pushes down and moves the thing upward. Just with electric thrusters you will have to push air down (or worse, photons) and for that you're going to need just incredible amount of energy that batteries cannot produce (yet), especially because for the extra power needed you'd need to keep adding weight in batteries and for rockets, that's very dumb as the whole point is to keep weight as low as possible.

Future batteries need to be very very dense and low weight for rockets that SpaceX produces to be possible.",2023-01-08 15:07:22,j3h2uan,t1_j3frt7o,/r/WhitePeopleTwitter/comments/106ah0w/behold_my_friends_the_brightest_mind_to_ever/j3h2uan/,-1,Positive
Away_Cat_7178,"Like him or not, you can't manage companies providing satellite internet, arguably the best-in-line EV cars, the most frontier technological brain-interface research institution and the best in class rocket launching and landing companies while reviving 2 from the dead when you're an idiot. If it was only a money matter Bezos would've outpaced him with Blue Origin. Delegating only goes that far.

To be that lucky is impossible. Whether he has a likable personality is otherwise.",2023-01-08 14:46:24,j3h03v1,t1_j3frt7o,/r/WhitePeopleTwitter/comments/106ah0w/behold_my_friends_the_brightest_mind_to_ever/j3h03v1/,-1,Positive
Rutabagaslim,"Put on some underwear, don't you mean spit balling? Lol",2023-01-08 16:53:27,j3hi887,t1_j3gpqem,/r/WhitePeopleTwitter/comments/106ah0w/behold_my_friends_the_brightest_mind_to_ever/j3hi887/,27,Positive
TerrariaGaming004,"Just because a random person said something stupid a while ago not only doesn’t mean that anybody believed them, but it also doesn’t mean that anything is possible",2023-01-08 15:45:49,j3h87v9,t1_j3gpqem,/r/WhitePeopleTwitter/comments/106ah0w/behold_my_friends_the_brightest_mind_to_ever/j3h87v9/,3,Negative
Lordhugs1,https://www.researchgate.net/publication/3110031_Launch_to_space_with_an_electromagnetic_railgun,2023-01-08 06:06:35,j3fqr6u,t1_j3fny2p,/r/WhitePeopleTwitter/comments/106ah0w/behold_my_friends_the_brightest_mind_to_ever/j3fqr6u/,185,Neutral
lastprophecy,"Couldn't you also use current to generate heat for plasma propulsion? Isn't NASA working on plasma propulsion? Honestly, it's the best bet if you're looking at interplanetary travel.

I still find it funny that the guy viewed as a SciFi visionary responsible for getting us to Mars, is limited to chemical combustion for propulsion, which was outdated in the late 50s.

He just had the money to cash in on other people's ideas, and when called on his BS retreats to twitter for validation that he is a Very Smart Boy.",2023-01-08 07:06:35,j3fwc15,t1_j3fny2p,/r/WhitePeopleTwitter/comments/106ah0w/behold_my_friends_the_brightest_mind_to_ever/j3fwc15/,25,Positive
Wyrran96,What I imagine is that we’d still call it a rocket out of habit even in that case. Just like Band-Aids instead of bandages.,2023-01-08 06:09:12,j3fr0kg,t1_j3fny2p,/r/WhitePeopleTwitter/comments/106ah0w/behold_my_friends_the_brightest_mind_to_ever/j3fr0kg/,12,Neutral
Hopped_Cider,"I’ll just leave this link here.  It is low thrust, but electric space propulsion.
https://en.wikipedia.org/wiki/Ion_thruster
P.S. Magnets don’t have a “charge” and don’t attract/repel “charges”",2023-01-08 07:14:26,j3fwzws,t1_j3fny2p,/r/WhitePeopleTwitter/comments/106ah0w/behold_my_friends_the_brightest_mind_to_ever/j3fwzws/,11,Neutral
Head-Bed2065,Rail gun rocket?,2023-01-08 08:02:53,j3g0z9i,t1_j3fny2p,/r/WhitePeopleTwitter/comments/106ah0w/behold_my_friends_the_brightest_mind_to_ever/j3g0z9i/,2,Neutral
Reagent_52,Hall effect thrusters are a thing. Hell the star link satellites use them.,2023-01-08 13:10:47,j3gpdp6,t1_j3fny2p,/r/WhitePeopleTwitter/comments/106ah0w/behold_my_friends_the_brightest_mind_to_ever/j3gpdp6/,2,Neutral
GoatBased,"> So, [an electric rocket] is absolutely possible. 

> Rocket propulsion, by definition, cannot be electric.

So which is it?

> As for newton, well, nothing. He should have never been brought up in the first place.

His point was that [""In vacuum, there is nothing to 'push' against. You must react against ejected mass.""](https://twitter.com/elonmusk/status/559555327515848705?lang=en)

An [electric rocket](https://en.wikipedia.org/wiki/Spacecraft_electric_propulsion) requires fuel.",2023-01-08 09:40:20,j3g8l1f,t1_j3fny2p,/r/WhitePeopleTwitter/comments/106ah0w/behold_my_friends_the_brightest_mind_to_ever/j3g8l1f/,6,Positive
TheBrightNights,"Na man, just use a bunch of fans going at insanely high speeds /s",2023-01-08 06:37:15,j3ftpkc,t1_j3fny2p,/r/WhitePeopleTwitter/comments/106ah0w/behold_my_friends_the_brightest_mind_to_ever/j3ftpkc/,4,Positive
TomSwirly,https://en.wikipedia.org/wiki/Ion_thruster,2023-01-08 09:17:40,j3g6un5,t1_j3fny2p,/r/WhitePeopleTwitter/comments/106ah0w/behold_my_friends_the_brightest_mind_to_ever/j3g6un5/,4,Neutral
nunyabidnesz,You could make something like a mag lev sling to shoot something into space though. Or a big f'ing rail gun.,2023-01-08 08:00:28,j3g0sa5,t1_j3fny2p,/r/WhitePeopleTwitter/comments/106ah0w/behold_my_friends_the_brightest_mind_to_ever/j3g0sa5/,1,Neutral
Senior-Albatross,There was a company that was trying to launch packages into LEO with a flywheel. Or a liner railgun could work.,2023-01-08 17:17:39,j3hm21n,t1_j3fny2p,/r/WhitePeopleTwitter/comments/106ah0w/behold_my_friends_the_brightest_mind_to_ever/j3hm21n/,1,Neutral
valiantknight639,"The way rockets work right now is they push something down and since every action has an equal and opposite reaction , the rockets is propelled upwards , hence newton’s 3rd law",2023-01-08 17:47:20,j3hqqqc,t1_j3fny2p,/r/WhitePeopleTwitter/comments/106ah0w/behold_my_friends_the_brightest_mind_to_ever/j3hqqqc/,2,Positive
GenerikRedditUser,"Attach your electromagnetic accelerator to the back of a vehicle with a source of ions, congratulations you have an electric rocket motor.",2023-01-08 18:59:26,j3i2kvq,t1_j3fny2p,/r/WhitePeopleTwitter/comments/106ah0w/behold_my_friends_the_brightest_mind_to_ever/j3i2kvq/,1,Neutral
