Author,Body,Created Time,Id,Parent_id,Permalink,Score,Sentiment
Kamikazekagesama,Yes? And it uses electricity as the source of energy. So it's an electric rocket that is in line with newtons third law.,2023-01-08 09:58:44,j3g9yte,t1_j3g9uq6,/r/WhitePeopleTwitter/comments/106ah0w/behold_my_friends_the_brightest_mind_to_ever/j3g9yte/,1,Neutral
toramanlis,"i'll break my promise.

you are impossible to discuss. u are an idiot. u don't have the capacity to comprehend what the other person is saying even if it's spoonfed to you. you are also arrogant enough to throw your disconnection from the discussion and lack of comprehension as if it's others' fault

baby steps

1. started with rocketry, electric propulsion and newton's third law.

2. you, as in your person, introduced the force of electric motors into the conversation. you said it was insufficient. your idea, your argument. nobody else. you.
3. that is how factories entered the discussion. to challenge your idea, which people normally do in discussions, i gave an example with industrial machines. YOU introduced force generated by electric motors, factories were mentioned in an example about the force of electric motors which YOU introduced in the discussion. there's no extra step. you introduced a concept and factories was directly related with that concept as an example. your concept -> factory example. and you know what it was an example about how irrelevant your concept was. factories was how i explained something you said was irrelevant. then you complained about factories being irrelevant. look


your idea about electric motor force -----------> factory example to explain it's irrelevant


4. it was also none other than you who mentioned electric vehicles not being able to overcome gravity. right there a couple of comments above. and again further above.


YOU say electric vehicles cant take off -------------> drones being mentioned because they can take off and they're electric

focus. collect your mind and examine the demonstration above until you get it

5. YOU ARE REPEATING THE SAME INFORMATION WITH COMPLETE DISREGARD TO WHAT RESPONSE YOU GET. WE GOT WHAT YOU SAY AND ADDRESSED IT, YOU ARE THE ONE WHO NEEDS TO UNDERSTAND. 

6. start from the top. one sentence at a time. don't jump to the next one one until you make sure you understand what is said in the current one. no rush. there's no deadline.

this was the last time i address your soup of information. not gonna come back here even if u get a hold on yourself and start conversing. i wasted more than enough time with you. you are dumb. not meant be an insult. some people are dumb and you are one of them. nothing to be ashamed of.",2023-01-08 18:37:45,j3hyzis,t1_j3hujf2,/r/WhitePeopleTwitter/comments/106ah0w/behold_my_friends_the_brightest_mind_to_ever/j3hyzis/,1,Negative
Anonymous_Bob_,Hell yeah! It’s nice to see some fellow rocket nerds here. And that’s exactly right.,2023-01-08 17:08:49,j3hknp4,t1_j3hio4w,/r/WhitePeopleTwitter/comments/106ah0w/behold_my_friends_the_brightest_mind_to_ever/j3hknp4/,2,Positive
OTee_D,"Correct, I didn't say that, but it's not the 'mass' of the gas that drives the vessel but the difference in potential and the resulting Lorenz or Coulomb force.

The gas is just the 'carrier' of the potential not  like ""blowing"" out of a thruster or as if it's mass is relevant to the process. The gas itself is NOT the propellant",2023-01-08 20:33:26,j3ii2r3,t1_j3igzb3,/r/WhitePeopleTwitter/comments/106ah0w/behold_my_friends_the_brightest_mind_to_ever/j3ii2r3/,0,Positive
OKura94,"I feel I better understand your argument here, but it still appears flawed.

firstly, I agree that industry is very specific about the terminology used, outside of public outreach, but point taken.

Let's then look at the limiting factor(s) on the thrust generated by ion drives (our most well known form of EPS). You are absolutely correct that the accelerated mass is significantly smaller than in chemical rockets, though typically in terms of the mols (number of molecules) ejected than the mass of said molecule. (meaning larger propellants are typically used, but a system could be designed to use more at once)

F=ma the force equation we all learn in school, as mass (m) goes down linearly F does as well.

but in using a smaller mass of propellant we can increase its velocity significantly higher with the same amount of energy (by virtue of it having lower inertia). If we decompose the same force formula to base units we get

N=kg\*(m/s\^2) (F replaced with newtons and mass with kilograms for sake of clarity and not having m defined twice)

We see here that force scales exponentially with linear increase in velocity (recall that m/s is scalar speed, which is being squared), this means that as long as the right velocity can be achieved in the propellant not only can we potentially make up for the loss in force (aka thrust) introduced by the decreased mass, we can potentially exceed it.

There are two limiting factors here though, we cannot accelerate the propellant to the speed of light, and the amount of energy required to accelerate the propellant also grows with the target speed.

There's nothing in the 3rd law that says we can't have ion drives or other EPS with escape level thrust, it's a matter of energy availability and cost. We use chemical rockets to get into space because it's cheaper, not because the other options break physics.",2023-01-08 22:20:07,j3izpc0,t1_j3iwfjy,/r/WhitePeopleTwitter/comments/106ah0w/behold_my_friends_the_brightest_mind_to_ever/j3izpc0/,0,Positive
TommyTuttle,"A rocket is a specific type of engine; by definition it does not *require* combustion but it does require some type of physical propellant flying out the back. Propellant functions as the mass that the rocket pushes against, to propel itself. That’s why rockets work in space, where helicopters don’t. 

An electric launch vehicle, sure, that’s perfectly possible. There is plenty of air for any type of engine to push against. I like the dream of mag-lev and if it ever works it’ll also revolutionize plain old air travel. Which is a very good thing imho. 

There currently is no means of propulsion in space that isn’t a rocket of some kind. Because there’s no air to push against, rocketry is currently the only known way to move stuff around.",2023-01-08 19:07:47,j3i3y8y,t1_j3i1gd8,/r/WhitePeopleTwitter/comments/106ah0w/behold_my_friends_the_brightest_mind_to_ever/j3i3y8y/,2,Positive
Anonymous_Bob_,Fair.,2023-01-08 15:37:05,j3h6yne,t1_j3h5twf,/r/WhitePeopleTwitter/comments/106ah0w/behold_my_friends_the_brightest_mind_to_ever/j3h6yne/,1,Positive
Anonymous_Bob_,"Hydrogen fuel is used in a “fuel cell” to produce electricity without combustion. 

Some people consider food to be fuel for the human body.

You can make the argument that “propellant” is a more proper term for inert gasses, and I’d agree with you. But fuel and propellant are often used interchangeably in the industry.",2023-01-08 16:13:43,j3hc90q,t1_j3h9yjk,/r/WhitePeopleTwitter/comments/106ah0w/behold_my_friends_the_brightest_mind_to_ever/j3hc90q/,1,Positive
symonx99,"A full electric engine wouldn't provider any kind of propulsion because there aren't any particles to launch backwards.
Well you could use the electrons of the current but they would give a minimal propulsion and are quite hard to pull out of the engine without putting something along their trajectory that would stop most of time.
So in this very strict sense Musk is right, but i'd say that's a really strict interpretation.

An electric car doesn't get any propulsion from the engine, neither a fuel car to tell the truth, the propulsion comes from the rotation of the wheels against the soil which is enabled by the engine.

So maybe we could call a ion thruster engine powered by electricity an electrically propelled rocket? Maybe, but it's a bit of a stretch and certainly it's not a fully electric method of rocket propulsion",2023-01-08 18:03:35,j3htbcb,t1_j3hs2yt,/r/WhitePeopleTwitter/comments/106ah0w/behold_my_friends_the_brightest_mind_to_ever/j3htbcb/,3,Positive
Professional_Dot2754,"It could, the others are morons. Electricity is photons. if you shot  enough at the ground, you could go up. This is the equivalent of going to space using a laser. It would be very hard, but does not violate the laws of physics.",2023-01-08 18:03:54,j3htd68,t1_j3hs2yt,/r/WhitePeopleTwitter/comments/106ah0w/behold_my_friends_the_brightest_mind_to_ever/j3htd68/,3,Negative
Dapper__Hippo,"You're confusing a rocket engine with the whole rocket. A rocket is a vehicle for travel, generally fast, from one point to another, generally space. However as we've had ground to ground rockets, rocket cars, and other ""rockets"" the idea that the propulsion is what makes it a rocket is on loose footing.

A rocket propelled into space by magnets would still be a rocket.",2023-01-08 06:11:07,j3fr7br,t1_j3fq1ll,/r/WhitePeopleTwitter/comments/106ah0w/behold_my_friends_the_brightest_mind_to_ever/j3fr7br/,5,Negative
technoferal,"See above. But this time, read it with the intent to understand, rather than to respond.",2023-01-09 02:55:13,j3k4io8,t1_j3k4f8w,/r/WhitePeopleTwitter/comments/106ah0w/behold_my_friends_the_brightest_mind_to_ever/j3k4io8/,1,Neutral
Fine-Funny6956,Don’t ask him if he knows what a JPEG is.  All he wanted was a picture of a god dang hot dog.,2023-01-08 16:39:30,j3hg3bo,t1_j3hdi11,/r/WhitePeopleTwitter/comments/106ah0w/behold_my_friends_the_brightest_mind_to_ever/j3hg3bo/,92,Positive
MyTummyHurts7,Yep,2023-01-08 16:48:09,j3hhemv,t1_j3hdi11,/r/WhitePeopleTwitter/comments/106ah0w/behold_my_friends_the_brightest_mind_to_ever/j3hhemv/,20,Neutral
OPsaBigFatPhony,Yep,2023-01-08 17:03:42,j3hjumq,t1_j3hdi11,/r/WhitePeopleTwitter/comments/106ah0w/behold_my_friends_the_brightest_mind_to_ever/j3hjumq/,17,Neutral
DDrewit,Yep,2023-01-08 17:21:36,j3hmoi1,t1_j3hdi11,/r/WhitePeopleTwitter/comments/106ah0w/behold_my_friends_the_brightest_mind_to_ever/j3hmoi1/,13,Neutral
Sodalime7,Dangolshootmanilltellyoowut,2023-01-08 20:56:00,j3ilwd1,t1_j3hdi11,/r/WhitePeopleTwitter/comments/106ah0w/behold_my_friends_the_brightest_mind_to_ever/j3ilwd1/,3,Neutral
Idabbleincrazy89,Uh-huh,2023-01-08 23:02:35,j3j6aru,t1_j3hdi11,/r/WhitePeopleTwitter/comments/106ah0w/behold_my_friends_the_brightest_mind_to_ever/j3j6aru/,2,Neutral
Wyvernkeeper,It's an older reference but it checks out..,2023-01-08 20:13:46,j3iess2,t1_j3h4tc5,/r/WhitePeopleTwitter/comments/106ah0w/behold_my_friends_the_brightest_mind_to_ever/j3iess2/,8,Positive
Muninwing,r/surprisebeowulf,2023-01-08 21:20:34,j3iq2un,t1_j3h4tc5,/r/WhitePeopleTwitter/comments/106ah0w/behold_my_friends_the_brightest_mind_to_ever/j3iq2un/,4,Neutral
forreasonsunknown79,"Ayyy, Beowulf and the Spear-Danes. Sounds like a techno-rock band.",2023-01-09 01:11:24,j3jpse4,t1_j3h4tc5,/r/WhitePeopleTwitter/comments/106ah0w/behold_my_friends_the_brightest_mind_to_ever/j3jpse4/,1,Neutral
Ac0usticKitty,I think you just insulted someone's great auntie,2023-01-09 02:10:42,j3jy7df,t1_j3h4tc5,/r/WhitePeopleTwitter/comments/106ah0w/behold_my_friends_the_brightest_mind_to_ever/j3jy7df/,1,Positive
pilgermann,"Right. But in no way can we say that an electric rocket violates the laws of physics, which is essentially what Musk is saying. We just don't have the tech. The point is it's not even theoretical that you can generate propulsion using electricity. We already can and do, in space craft no less, just those already in space.",2023-01-08 16:27:32,j3heaex,t1_j3gvgh0,/r/WhitePeopleTwitter/comments/106ah0w/behold_my_friends_the_brightest_mind_to_ever/j3heaex/,94,Positive
Ceshomru,Magnets. Its always magnets.,2023-01-08 14:53:59,j3h12zm,t1_j3gvgh0,/r/WhitePeopleTwitter/comments/106ah0w/behold_my_friends_the_brightest_mind_to_ever/j3h12zm/,77,Neutral
SuperCouchHumper,"So I guess this is a limitation of our engineering capabilities, not the laws of physics.",2023-01-08 15:58:36,j3ha25a,t1_j3gvgh0,/r/WhitePeopleTwitter/comments/106ah0w/behold_my_friends_the_brightest_mind_to_ever/j3ha25a/,25,Neutral
DontBeTHATVegan,"I agree that it will not be easy, but remember that global wireless touchscreen-based telecommunication systems that also connected to the internet wirelessly via wifi and was readily accessible and able to be adopted globally was considered science fiction (or at least incredibly unimaginable) just 20 years ago. 

While we had the rudimentary tech before this time, it would have been hard to imagine going from the bricks and flip phones of the 1990's to the high-tech touchscreen devices that can make calls, texts, use the internet, take pictures using multiple cameras, have vibration modes, GPS, wifi, etc.",2023-01-08 15:56:09,j3h9pbu,t1_j3gvgh0,/r/WhitePeopleTwitter/comments/106ah0w/behold_my_friends_the_brightest_mind_to_ever/j3h9pbu/,6,Positive
ausernamethatistoolo,The rocket does not need to take off from the ground. I don't know why everyone is focused on escape velocity given that it wasn't in the initial question or the response.,2023-01-08 15:47:01,j3h8e3f,t1_j3gvgh0,/r/WhitePeopleTwitter/comments/106ah0w/behold_my_friends_the_brightest_mind_to_ever/j3h8e3f/,21,Neutral
Its-the-Chad82,"I love to rip on Elon but I think his response actually makes sense for exactly the reason you said.  Electric cars work because of friction and while I would love to be proven wrong, I don't think an electric rocket is possible.",2023-01-08 17:19:53,j3hmeor,t1_j3gvgh0,/r/WhitePeopleTwitter/comments/106ah0w/behold_my_friends_the_brightest_mind_to_ever/j3hmeor/,3,Positive
goomyman,Difficult?  You mean impossible.   There isn’t enough air to throw backwards using friction.   You need to throw something back to go forward.   Aka Newton’s third law.,2023-01-08 16:58:58,j3hj3g0,t1_j3gvgh0,/r/WhitePeopleTwitter/comments/106ah0w/behold_my_friends_the_brightest_mind_to_ever/j3hj3g0/,3,Negative
Biscuits4u2,"Yes but the question was can you build an electric rocket, not can you build an electric rocket with no propellant.",2023-01-08 16:23:49,j3hdqmt,t1_j3gvgh0,/r/WhitePeopleTwitter/comments/106ah0w/behold_my_friends_the_brightest_mind_to_ever/j3hdqmt/,1,Neutral
want_to_join,"Nah, think rail guns but for spaceships.",2023-01-08 15:32:04,j3h6931,t1_j3gvgh0,/r/WhitePeopleTwitter/comments/106ah0w/behold_my_friends_the_brightest_mind_to_ever/j3h6931/,1,Neutral
The7SeasSalamander,"Well, this technically would be electric, use a railgun. Long and tall stretch of rail and just shoot the rocket to space. Just.. ignore the g-forces. Probably wouldn’t work too well for manned missions.

Though curious if you could have a long enough stretch to allow for gradual acceleration up to that point and how much extra electricity it would use to move gradually vs. fast as possible. Either way would probably be the largest bank of capacitors in existence to railgun something into space.

But hey, a massive railgun like that could double as a planetary defense system?",2023-01-08 16:23:46,j3hdqd9,t1_j3gvgh0,/r/WhitePeopleTwitter/comments/106ah0w/behold_my_friends_the_brightest_mind_to_ever/j3hdqd9/,1,Neutral
Draegur,"perhaps with some as-yet-undiscovered method with obscene efficiency, electricity could be used to accelerate a reaction mass with such velocity that it takes relatively little fuel to impart a significant amount of kinetic force. 

... there'd be several major drawbacks, though, the least of which being that such tightly concentrated thrust *miiiiiiiight* destroy everything the tail-end of the rocket is pointed at.

a continuous coherent beam of atoms at relativistic velocities shredding every molecule they impact, like a man-made cosmic ray fountain spallating the molecules of the atmosphere behind it, even down and into the crust, spraying ultraviolet light, x rays, and gamma rays in every direction...

probably not a good idea >_>;",2023-01-08 17:25:13,j3hn97e,t1_j3gvgh0,/r/WhitePeopleTwitter/comments/106ah0w/behold_my_friends_the_brightest_mind_to_ever/j3hn97e/,1,Negative
DefinitelyNotAliens,"Well, technically, a rocket is a cylinder fueled by a combustible propellent. If we were able to... launch a device using railgun like technology, you wouldn't have a rocket. You'd have a projectile, sure. But not a rocket.

Even if you were able to achieve nuclear photonic propulsion there's a question of 'is it a rocket' since it doesn't use combustion of fuel to propel itself. It's nuclear fission to achieve photonic thrust.

I think there is no such thing as an electric rocket because rockets by definition use combustion. Like asking for an electric engine. You can potentially power a car, lawnmower or other item with electricity, but it won't have an engine. It'll have a motor.

Can we theoretically power long-range flying tube things with electricity? Maybe in the future. But they wouldn't meet the current definition of a rocket.

Either way, the issue isn't Newton's 3rd law. It's current tech and the technical definition of a rocket needing combustion.",2023-01-08 18:31:52,j3hxzyk,t1_j3gvgh0,/r/WhitePeopleTwitter/comments/106ah0w/behold_my_friends_the_brightest_mind_to_ever/j3hxzyk/,1,Positive
BetterEveryLeapYear,"You don't need a propellant to get to orbit. You can use mass accelerators which provide the power down on the surface, obviously easily sourced by electric; then when they get to space, they can operate on electric (ion) propulsion. We're even developing some of these mass accelerators now, like SpinLaunch.  


[https://en.wikipedia.org/wiki/SpinLaunch](https://en.wikipedia.org/wiki/SpinLaunch)",2023-01-08 18:32:54,j3hy68c,t1_j3gvgh0,/r/WhitePeopleTwitter/comments/106ah0w/behold_my_friends_the_brightest_mind_to_ever/j3hy68c/,1,Positive
DawnOfTheTruth,What about a big ass electro magnet setup. Gargantuan. Rail gun if you will. Can’t limit the idea to have the propulsion attached to the rocket. Reentry too. Though the contents of the rocket might be mush. But that’s not the question.,2023-01-08 21:13:41,j3ioxfr,t1_j3gvgh0,/r/WhitePeopleTwitter/comments/106ah0w/behold_my_friends_the_brightest_mind_to_ever/j3ioxfr/,1,Negative
abdelrahmanbbb,Rail gun to launch it and ion thrusters when you get to orbit.,2023-01-08 22:08:44,j3ixwlx,t1_j3gvgh0,/r/WhitePeopleTwitter/comments/106ah0w/behold_my_friends_the_brightest_mind_to_ever/j3ixwlx/,1,Neutral
theonewhoknocksforu,Electromagnetic force is a possibility. A high density plasma or nuclear fission are possible propulsion sources too.,2023-01-08 23:15:50,j3j8c32,t1_j3gvgh0,/r/WhitePeopleTwitter/comments/106ah0w/behold_my_friends_the_brightest_mind_to_ever/j3j8c32/,1,Positive
sandersking,Eli5: How do helicopters achieve enough lift?,2023-01-08 23:58:32,j3jexjk,t1_j3gvgh0,/r/WhitePeopleTwitter/comments/106ah0w/behold_my_friends_the_brightest_mind_to_ever/j3jexjk/,1,Neutral
vlsdo,You really don't need a propellant. You can move things with light. There's work on putting stuff into space that way (shoot a powerful laser at it until it's high enough).,2023-01-08 19:50:11,j3iava2,t1_j3gvgh0,/r/WhitePeopleTwitter/comments/106ah0w/behold_my_friends_the_brightest_mind_to_ever/j3iava2/,0,Positive
dotslashpunk,yeah but it’s stilly to just say “newtons third law” there when really Gauss’ laws on electromagnetism are what are stopping you here. Dude just pulled out whatever law he knew at the moment. Hell even thermodynamics would be more relevant.,2023-01-08 20:39:54,j3ij681,t1_j3gvgh0,/r/WhitePeopleTwitter/comments/106ah0w/behold_my_friends_the_brightest_mind_to_ever/j3ij681/,0,Positive
DontBeTHATVegan,"Massive slingshot, lol

Just yeet rockets into space",2023-01-08 16:01:10,j3hafmf,t1_j3h9ynq,/r/WhitePeopleTwitter/comments/106ah0w/behold_my_friends_the_brightest_mind_to_ever/j3hafmf/,2,Positive
Ok_Opportunity8008,"“Compressed Air”
 
You mean propellant?",2023-01-08 13:14:20,j3gppru,t1_j3gp6wu,/r/WhitePeopleTwitter/comments/106ah0w/behold_my_friends_the_brightest_mind_to_ever/j3gppru/,11,Negative
TheHolyJamsheed302,This is peak fucking Reddit lol. Idiot redditors become actual rocket scientists to shit on the guy who actually innovated the space industry,2023-01-08 14:03:34,j3guw93,t1_j3gp6wu,/r/WhitePeopleTwitter/comments/106ah0w/behold_my_friends_the_brightest_mind_to_ever/j3guw93/,-12,Negative
DontBeTHATVegan,Elon doesn't know shit about physics and wouldn't be able to explain an ion engine if it hit him in the face.,2023-01-08 20:56:28,j3ilz6n,t1_j3hu997,/r/WhitePeopleTwitter/comments/106ah0w/behold_my_friends_the_brightest_mind_to_ever/j3ilz6n/,1,Positive
DontBeTHATVegan,"There are various things we can utilize to get a rocket into space without specifically needing a combustion engine to do so. Including flinging them into space via a centrifuge. No reason why you can't fling the rocket into space this way and then utilize and electric propulsion engine once in space. 

Crewed missions would be more complicated, but ultimately it does not matter, as a rocket does not need a crew to be a rocket.",2023-01-08 21:13:51,j3ioyfz,t1_j3i38w8,/r/WhitePeopleTwitter/comments/106ah0w/behold_my_friends_the_brightest_mind_to_ever/j3ioyfz/,1,Neutral
DontBeTHATVegan,"Sure, I'll give you that. If we are only focusing on the Grammar-Nazi definition of a rocket, then yes.",2023-01-08 20:59:12,j3imfni,t1_j3i7ca4,/r/WhitePeopleTwitter/comments/106ah0w/behold_my_friends_the_brightest_mind_to_ever/j3imfni/,1,Positive
DontBeTHATVegan,"No, nimrod. Elon is wrong because he, and you, don't understand Newton's Third Law, which states: "" **for every action (force) in nature there is an equal and opposite reaction**. ""

Literally, nothing about this law dictates that electric propulsion (which currently exists right now in 2023) cannot become strong enough to launch a rocket into space outside of the fact that we don't have the tech to do it right this very second. 

Unless you want to write up how Elon understands this law better than millions of actual physicists and can determine that this technology is impossible so you can win your Nobel Prize for being a bootlicker.",2023-01-08 17:41:54,j3hpwaw,t1_j3hcq7z,/r/WhitePeopleTwitter/comments/106ah0w/behold_my_friends_the_brightest_mind_to_ever/j3hpwaw/,3,Positive
DickSota,I think this is the most sane take here.,2023-01-08 20:21:10,j3ig125,t1_j3hx4hi,/r/WhitePeopleTwitter/comments/106ah0w/behold_my_friends_the_brightest_mind_to_ever/j3ig125/,2,Positive
Financial_Nebula,"I didn’t mean to make it seem like I was arguing, I’m sorry if I did.",2023-01-08 23:21:13,j3j95w6,t1_j3hx4hi,/r/WhitePeopleTwitter/comments/106ah0w/behold_my_friends_the_brightest_mind_to_ever/j3j95w6/,1,Negative
Kr155,A rail gun pushes a projectile. The projectile goes one way the gun goes the other.,2023-01-08 14:04:37,j3gv0em,t1_j3gpepu,/r/WhitePeopleTwitter/comments/106ah0w/behold_my_friends_the_brightest_mind_to_ever/j3gv0em/,3,Negative
KvastaSaber,"True, but there are many type of propulsion that could use electricity as the source of energy to produce that force. Rocket fuel was used because it has a high energy potential vs a low weight and it emits superheated gases for thrust. The cost is high though, a rail gun or a slingshot launcher is already being looked at for more economical launch cost. Once you are out of the earths gravitational pull the amount of thrust needed is less.",2023-01-08 16:35:42,j3hfibs,t1_j3gpepu,/r/WhitePeopleTwitter/comments/106ah0w/behold_my_friends_the_brightest_mind_to_ever/j3hfibs/,4,Positive
frotz1,Yeah and it uses electricity to move the propellant. I'm not sure what hair you're trying to split here but it's definitely electric propulsion by any meaningful definition of those words.,2023-01-08 14:35:47,j3gyrct,t1_j3gyk97,/r/WhitePeopleTwitter/comments/106ah0w/behold_my_friends_the_brightest_mind_to_ever/j3gyrct/,6,Positive
frotz1,Elon's own products use hall effect thrusters to move spacecraft from one place to another. The hall effect thrusters use energy (electricity) to expell a propellant to drive the vehicle in a desired (opposite) direction. Please explain how to distinguish that from a rocket when that's actually one of the most common definitions of the word rocket.,2023-01-09 02:24:46,j3k0848,t1_j3jjarh,/r/WhitePeopleTwitter/comments/106ah0w/behold_my_friends_the_brightest_mind_to_ever/j3k0848/,1,Positive
Blackhound118,Even if it uses electrons as reaction mass?,2023-01-08 21:44:34,j3iu0ug,t1_j3gysa2,/r/WhitePeopleTwitter/comments/106ah0w/behold_my_friends_the_brightest_mind_to_ever/j3iu0ug/,1,Neutral
8orn2hul4,"Okay, but that’s not what he said, is it? He implied Newton’s third law proves electric rockets aren’t possible. Which isn’t true? At all? And nothing you’ve said has change that? I understand an electric rocket would be harder, but that’s not the conversation we’re having",2023-01-08 19:15:42,j3i5999,t1_j3grlgl,/r/WhitePeopleTwitter/comments/106ah0w/behold_my_friends_the_brightest_mind_to_ever/j3i5999/,0,Positive
ausernamethatistoolo,So electric rockets are possible then,2023-01-08 15:49:33,j3h8r6n,t1_j3gyywo,/r/WhitePeopleTwitter/comments/106ah0w/behold_my_friends_the_brightest_mind_to_ever/j3h8r6n/,2,Neutral
PhysicsCentrism,Photons exist and have momentum. Momentum must be conserved. Photons do not have mass.,2023-01-08 17:54:58,j3hry37,t1_j3gyywo,/r/WhitePeopleTwitter/comments/106ah0w/behold_my_friends_the_brightest_mind_to_ever/j3hry37/,1,Neutral
