Author,Body,Created Time,Id,Parent_id,Permalink,Score,Sentiment
Maj-Malfunction,Of course you can't make an electric rocket. Don't you realize how long the extension cord would have to be to reach orbit? Duh!,2023-01-08 05:52:21,j3fpbti,t3_106ah0w,/r/WhitePeopleTwitter/comments/106ah0w/behold_my_friends_the_brightest_mind_to_ever/j3fpbti/,10917,Negative
GENERICLIES,"Pretty sure it'd depend on exactly how you define a rocket, and electric rocket.Like, lets say, Ion thrusters' using solar or a Nuclear Electric Rocket. You can definitely use electricity to accelerate some reaction mass as well, and a nuclear source can provide enough power to do quite a bit of exotic stuff.

The part that is a bit less likely is, can you build an electric rocket that can reach orbit from the ground....",2023-01-08 05:39:57,j3fo102,t3_106ah0w,/r/WhitePeopleTwitter/comments/106ah0w/behold_my_friends_the_brightest_mind_to_ever/j3fo102/,2793,Positive
SocietyOdd,"No, fig newton's law",2023-01-08 05:17:56,j3flnna,t3_106ah0w,/r/WhitePeopleTwitter/comments/106ah0w/behold_my_friends_the_brightest_mind_to_ever/j3flnna/,3569,Neutral
BringerOfLemonade,[This technology has been worked on since the 1960s](https://en.m.wikipedia.org/wiki/Hall-effect_thruster). It's not even a new technology. He is just an idiot with no actual engineering or science degree.,2023-01-08 06:21:23,j3fs7dr,t3_106ah0w,/r/WhitePeopleTwitter/comments/106ah0w/behold_my_friends_the_brightest_mind_to_ever/j3fs7dr/,7094,Negative
DutifulDuck458,He's a few lightbulbs short of newtons law,2023-01-08 05:11:51,j3fkzmk,t3_106ah0w,/r/WhitePeopleTwitter/comments/106ah0w/behold_my_friends_the_brightest_mind_to_ever/j3fkzmk/,1004,Negative
LastFreeName436,"This man is an idiot, stop listening to him",2023-01-08 06:17:18,j3frt7o,t3_106ah0w,/r/WhitePeopleTwitter/comments/106ah0w/behold_my_friends_the_brightest_mind_to_ever/j3frt7o/,752,Negative
mrscottstot,"Fun fact (I’m free-balling on some details here that I don’t specifically remember off the top of my head but it’s the general gist): the New York Times said something similar in like the 1920s or 30s or so and kinda put Robert Goddard (father of liquid rocket propulsion) on blast. That since space was empty, rockets couldn’t work there since there’d be nothing to push off (their logic). I think they ended up publishing an apology letter to Robert Goddard after Apollo 11 splashed down back home.",2023-01-08 13:14:32,j3gpqem,t3_106ah0w,/r/WhitePeopleTwitter/comments/106ah0w/behold_my_friends_the_brightest_mind_to_ever/j3gpqem/,88,Positive
bryalb,"So, it is absolutely possible. A giant electro magnet can repel a like charge into space. Kind of like a catapult. Rocket propulsion, by definition, cannot be electric. But it is possible, maybe not plausible, to send a projectile into space with electricity. As for newton, well, nothing. He should have never been brought up in the first place.",2023-01-08 05:39:10,j3fny2p,t3_106ah0w,/r/WhitePeopleTwitter/comments/106ah0w/behold_my_friends_the_brightest_mind_to_ever/j3fny2p/,758,Positive
Psychological_Lime51,"Physicist here and I'm seeing some misconceptions so here's some physics facts:

1. Newton's 3rd law requires a (self propelled) rocket to fire matter (or anything with momentum) downwards in order to accelerate upwards. Therefore, there cannot be a truly emissions-free rocket. However, those emissions do not have to be environmentally harmful, and they don't have to be fuel byproducts.

2. We currently don't have feasible technology to serve as alternatives to fossil fuels in rockets. That doesn't mean that such a thing is impossible.

Edit: There are solid rockets, which use hydrogen and oxygen. And in the future these materials could be created using electricity and water. However, currently we source our hydrogen from natural gas (a fossil fuel).

All in all, while there is some truth to what he said, it's an oversimplification.",2023-01-08 09:06:10,j3g5yy4,t3_106ah0w,/r/WhitePeopleTwitter/comments/106ah0w/behold_my_friends_the_brightest_mind_to_ever/j3g5yy4/,319,Negative
PolyZex,"I'm not sure what he means by his answer- but he is right that you can't have an electric rocket.  You could use electricity to accelerate ions but it would still be an ionic rocket.  Maybe a laser rocket, but electricity itself won't produce thrust.",2023-01-08 10:24:41,j3gbwjq,t3_106ah0w,/r/WhitePeopleTwitter/comments/106ah0w/behold_my_friends_the_brightest_mind_to_ever/j3gbwjq/,9,Positive
DM_DM_DND,"I am getting real tired of listening to Elon be dumb as a box of bricks.

Elon probably thinks ""Electric"" means ""No emissions"", because he's dumb. That's basically the only way to understand this, and my brain *hurts* trying to model this stupidity coming from someone who *sells electric cars and rockets.*

Which is just...Such an idiotic proposition that it's astounding. There are three or four ways to use magnetic and electric fields to create pulse, ranging from ion thrusters (which are actually *on spaceships*) to electromagnetic mass drivers that propel mass behind the ship, to some photon rocket designs. Literally all of these would qualify as electric rockets, that generate thrust from electricity.

You can even claim that some torchship designs that use magnetic nozzles to direct fusion products are, in part, a electric rocket because the magnetic field is effectively helping to generate thrust from the charged ions produced by the fusion.

But Mr. Elon Musk does not understand what the word rocket means. He barely understands what the word electric means. The only thing Elon Musk understands is what some marketing head tells him is the *marketing campaign* of Tesla-zero emissions.

Nothing else registers, so when someone says ""electric rocket"" he thinks they mean ""zero emission rocket"".

If you need any more proof that Elon has done *nothing* intellectual to deserve his wealth, look no further.",2023-01-08 06:54:27,j3fv9nx,t3_106ah0w,/r/WhitePeopleTwitter/comments/106ah0w/behold_my_friends_the_brightest_mind_to_ever/j3fv9nx/,358,Negative
woronwolk,"Not defending Elon (he's a piece of shit), but the amount of people mentioning ion thrusters here is astonishing. Ion thrusters still require a propellant, that's where they take the ions to accelerate from. Usually it's some kind of noble gas, and they're very useful for small spacecrafts since they don't require a lot of it (just a few kilograms can be enough for several years). But it's still not an entirely electric rocket, because it's not just electricity that it needs to propel itself.

And no, [EnDrive](https://en.wikipedia.org/wiki/EmDrive?wprov=sfla1) doesn't work either (see the section on theoretical inconsistencies and experimental errors).

There is one thing called photonic rocket, and it can theoretically propel itself with electricity only, but, if I understand it correctly, a solar sail is much more efficient as you can propel it with a laser beam instead of carrying huge generators that are more powerful than anything we've ever created, as well as fuel for them on board – and solar sail is technically not a rocket.

And anyway you wouldn't launch a photonic rocket or a solar sail from a planet, since either the thrust would be too slow, or the energy released would be too destructive.

So, as much of a stupid piece of shit Elon is, he's generally correct on this one, with a little asterisk on photonic rockets.",2023-01-08 11:53:46,j3giq59,t3_106ah0w,/r/WhitePeopleTwitter/comments/106ah0w/behold_my_friends_the_brightest_mind_to_ever/j3giq59/,71,Positive
sleepyjohn00,"Good thing he didn't try to put ion drives into his cars, because they've been sending probes all over the system.",2023-01-08 05:24:21,j3fmd62,t3_106ah0w,/r/WhitePeopleTwitter/comments/106ah0w/behold_my_friends_the_brightest_mind_to_ever/j3fmd62/,76,Positive
feedb4k,"“A rocket (from Italian: rocchetto, lit. 'bobbin/spool')[nb 1][1] is a vehicle that uses jet propulsion to accelerate without using the surrounding air. A rocket engine produces thrust by reaction to exhaust expelled at high speed.[2] Rocket engines work entirely from propellant carried within the vehicle; therefore a rocket can fly in the vacuum of space.”

Most of the comments in this thread are wildly uneducated.",2023-01-08 14:14:36,j3gw6f1,t3_106ah0w,/r/WhitePeopleTwitter/comments/106ah0w/behold_my_friends_the_brightest_mind_to_ever/j3gw6f1/,33,Positive
NoirGamester,"""I didn't write Brannigan's Law, I just enforce it"" - Zapp Brannigan",2023-01-08 16:06:59,j3hb9uv,t3_106ah0w,/r/WhitePeopleTwitter/comments/106ah0w/behold_my_friends_the_brightest_mind_to_ever/j3hb9uv/,8,Neutral
Nousagisan,I’d say a rocket to me is a device that achieves thrust by the expulsion of a propellant since that’s how we define the eponymous rocket equation. So an electric rocket in the same way that an electric motor engine works wouldn’t ever work because you can’t just make thrust like you can make torque. But you can absolutely make engines that use primarily a battery to accelerate a propellant like an ion engine or something.,2023-01-08 13:04:00,j3goq9n,t3_106ah0w,/r/WhitePeopleTwitter/comments/106ah0w/behold_my_friends_the_brightest_mind_to_ever/j3goq9n/,5,Positive
Go-to-gulag,"Y’all acting like you are so smart citing ion thrusters even tho it is clear that it doesn’t produce enough thrust to put an object on orbit, and even if it did it is not an « electric rocket » since it still needs a propellant to throw ion from and create thrust from Newton’s third law like all rockets, I don’t like Elon Musk but start to think before writing comments and if you don’t know shit about physics then just don’t write them.",2023-01-08 14:38:32,j3gz426,t3_106ah0w,/r/WhitePeopleTwitter/comments/106ah0w/behold_my_friends_the_brightest_mind_to_ever/j3gz426/,32,Positive
MouseBotMeep,"Probably not. We could have electromagnetic rail launchers or space elevators to launch payloads into orbit, but don’t quote me on that.",2023-01-08 13:28:16,j3gr3vy,t3_106ah0w,/r/WhitePeopleTwitter/comments/106ah0w/behold_my_friends_the_brightest_mind_to_ever/j3gr3vy/,6,Neutral
aoddawg,"Ion thrusters (which accelerate ions like xenon using electricity) exist and have very high specific impulse because they can apply a small thrust for a long, long time.  This can eventually efficiently (in terms of % mass ejected) produce large velocities for long duration space maneuvers.  These engines can’t produce enough thrust to escape the gravity of massive bodies, which is why solid and chemical rockets are still used.",2023-01-08 15:41:44,j3h7mzr,t3_106ah0w,/r/WhitePeopleTwitter/comments/106ah0w/behold_my_friends_the_brightest_mind_to_ever/j3h7mzr/,13,Positive
CheesecakeFull6176,"Every single comment is shitting on Elon's take, but he's basically right. You need to throw something out the back to make it go forward.",2023-01-08 13:23:45,j3gqneo,t3_106ah0w,/r/WhitePeopleTwitter/comments/106ah0w/behold_my_friends_the_brightest_mind_to_ever/j3gqneo/,17,Positive
upvote-button,Idk who's dumber. The economist portraying himself as an engineer or everyone that buys it,2023-01-08 05:13:05,j3fl4h9,t3_106ah0w,/r/WhitePeopleTwitter/comments/106ah0w/behold_my_friends_the_brightest_mind_to_ever/j3fl4h9/,47,Neutral
an_ickle_egg,"Ok, but in this particular instance he's right?

For rocket related propulsion you have to leave something behind.

Ion engines etc might use more electricity and less fuel but they work by launching tiny amounts of stuff in the opposite direction to where you want to go.

That's newton's third law in action.

Muskrat is a turd and an idiot, you don't need to make up reasons to call him such.",2023-01-08 06:42:20,j3fu6jp,t3_106ah0w,/r/WhitePeopleTwitter/comments/106ah0w/behold_my_friends_the_brightest_mind_to_ever/j3fu6jp/,25,Positive
frankandbeans13,Soon Elon is gonna buy reddit and totally fuck it up as well.,2023-01-08 15:38:59,j3h78nr,t3_106ah0w,/r/WhitePeopleTwitter/comments/106ah0w/behold_my_friends_the_brightest_mind_to_ever/j3h78nr/,8,Negative
Apprehensive_Dot_,Isn’t he just saying that you need propellant or to expel mass at high speed to make the rocket move and so a fully electric rocket that does not exchange mass with the outside of the system is not possible. At least with our current understanding?,2023-01-08 13:42:59,j3gsmdb,t3_106ah0w,/r/WhitePeopleTwitter/comments/106ah0w/behold_my_friends_the_brightest_mind_to_ever/j3gsmdb/,11,Negative
mrthenarwhal,"Anyone who thinks a Hall effect thruster qualifies as an electric rocket, kindly tell me the last time you heard of an electric vehicle being filled with propellant. By that common definition of an electric vehicle, an electric rocket is obviously impossible. Also, propellant is not combustion fuel, propellant is the stuff you throw out the back at high speeds in order to go really fast.",2023-01-08 17:21:49,j3hmppl,t3_106ah0w,/r/WhitePeopleTwitter/comments/106ah0w/behold_my_friends_the_brightest_mind_to_ever/j3hmppl/,13,Positive
Iamvanno,He meant Newton's 4th law that deals with the length of extension cords.,2023-01-08 14:03:32,j3guw2a,t3_106ah0w,/r/WhitePeopleTwitter/comments/106ah0w/behold_my_friends_the_brightest_mind_to_ever/j3guw2a/,9,Neutral
Bulky-Internal8579,"Newton's third law states that **for every action (force) in nature there is an equal and opposite reaction**. If object A exerts a force on object B, object B also exerts an equal and opposite force on object A. 

In other words, Space Karen doesn't have a clue what he's talking about.",2023-01-08 06:15:58,j3frofy,t3_106ah0w,/r/WhitePeopleTwitter/comments/106ah0w/behold_my_friends_the_brightest_mind_to_ever/j3frofy/,102,Negative
DisfavoredFlavored,"""That's right, for every action there's a reaction. That's why I respond to literally everything that ever gets tweeted, I have no li- I mean, Newton's 3rd law.""",2023-01-08 11:21:40,j3gg7oo,t3_106ah0w,/r/WhitePeopleTwitter/comments/106ah0w/behold_my_friends_the_brightest_mind_to_ever/j3gg7oo/,3,Positive
SnowLeopard42,I have heard of an ion drive for deep space exploration. The vehicle emits ions in one direction. Because of Newtons Laws( action and reaction are equal and opposite ) the vehicle will move in the opposite direction,2023-01-08 12:46:12,j3gn31w,t3_106ah0w,/r/WhitePeopleTwitter/comments/106ah0w/behold_my_friends_the_brightest_mind_to_ever/j3gn31w/,3,Positive
LiamJohnRiley,"The law:

 “An electric rocket is not possible”

-Isaac Newton",2023-01-08 14:08:01,j3gvekn,t3_106ah0w,/r/WhitePeopleTwitter/comments/106ah0w/behold_my_friends_the_brightest_mind_to_ever/j3gvekn/,3,Neutral
Lighting,"On the internet, to receive the correct answer just confidently and simply state a wrong one.",2023-01-08 15:03:15,j3h2ash,t3_106ah0w,/r/WhitePeopleTwitter/comments/106ah0w/behold_my_friends_the_brightest_mind_to_ever/j3h2ash/,3,Neutral
cpe111,Isn’t an ion engine essentially an electric rocket ?,2023-01-08 15:29:32,j3h5w5c,t3_106ah0w,/r/WhitePeopleTwitter/comments/106ah0w/behold_my_friends_the_brightest_mind_to_ever/j3h5w5c/,3,Neutral
knowone1313,"Seems to me like Elon is thinking rocket while everyone in the comments are thinking satellites, or spaceships. I don't think hall thrusters would be very effective at maneuvering a rocket into orbit. They certainly aren't powerful enough to put one into orbit without another type of rocket engine using solid or liquid fuel.",2023-01-08 15:50:56,j3h8y6z,t3_106ah0w,/r/WhitePeopleTwitter/comments/106ah0w/behold_my_friends_the_brightest_mind_to_ever/j3h8y6z/,3,Positive
halti3615,"Actually! You can make electric rocket engines. They're called ion engines and are used to propel smaller satellites. They are incredibly efficient at the cost of their infinitesimally  small thrust, however they would never be able to make a conventional rocket lift off from Earth at least.",2023-01-08 15:58:40,j3ha2j4,t3_106ah0w,/r/WhitePeopleTwitter/comments/106ah0w/behold_my_friends_the_brightest_mind_to_ever/j3ha2j4/,3,Positive
deathboy2098,"Elon's third law: ""A cunt in business tends to stay in business""",2023-01-08 16:40:42,j3hg9z2,t3_106ah0w,/r/WhitePeopleTwitter/comments/106ah0w/behold_my_friends_the_brightest_mind_to_ever/j3hg9z2/,3,Neutral
meseeksordie,He's not a genius at science. He's a genius on how to lose 200 billion dollars in like a week.,2023-01-08 16:47:04,j3hh8pn,t3_106ah0w,/r/WhitePeopleTwitter/comments/106ah0w/behold_my_friends_the_brightest_mind_to_ever/j3hh8pn/,3,Neutral
OTee_D,"https://en.wikipedia.org/wiki/Ion_thruster

The only issue is that it's only practical outside earths field of gravity as it doesn't provide enough thrust to operate against earth's pull.

So it would not be a ""lift off"" engine but a ""travel engine"" once you are outer space.",2023-01-08 18:21:24,j3hw8uy,t3_106ah0w,/r/WhitePeopleTwitter/comments/106ah0w/behold_my_friends_the_brightest_mind_to_ever/j3hw8uy/,3,Neutral
meatmechdriver,"ah yes, we could never use electricity to move mass around could we?",2023-01-08 18:39:28,j3hz9od,t3_106ah0w,/r/WhitePeopleTwitter/comments/106ah0w/behold_my_friends_the_brightest_mind_to_ever/j3hz9od/,3,Neutral
hummus_is_yummus1,"Impossible, no. Highly improbable without a major advancement in power storage tech, yes. Source: aerospace engineer",2023-01-08 20:08:11,j3idvk2,t3_106ah0w,/r/WhitePeopleTwitter/comments/106ah0w/behold_my_friends_the_brightest_mind_to_ever/j3idvk2/,3,Negative
bunchabytes,I think he’s actually right on this one. Still a nobbit. But correct.,2023-01-08 20:11:43,j3iegn3,t3_106ah0w,/r/WhitePeopleTwitter/comments/106ah0w/behold_my_friends_the_brightest_mind_to_ever/j3iegn3/,3,Positive
Gabriel_Crow1990,"For every action (force) in nature there is an equal and opposite reaction. If object A exerts a force on object B, object B also exerts an equal and opposite force on object A. 

What the fuck is this dummy on about?",2023-01-08 22:23:12,j3j06mc,t3_106ah0w,/r/WhitePeopleTwitter/comments/106ah0w/behold_my_friends_the_brightest_mind_to_ever/j3j06mc/,3,Negative
Dalsiran,"Well, using pure electricity to make a rocket is impossible because you need to shoot something really fast in one direction to make the rocket move in the opposite direction. Ion thrusters are the closest thing we have to an electric rocket engine, and they aren't really ""electric"" engines because they still use propellant, namely xenon. They work by (in layman's terms) bombarding xenon atoms with electrons ionize them, and once they're ionized a grid of holes at the back of the engine accelerate the ions very fast out the back of the engine. Bear in mind this is simplifying how they work the the point of error, they are a lot more complicated than that, but that's the very basic concept.

So to answer the question of can you make an electric rocket, the answer is yes and no. Yes, you can make a rocket where the primary energy to propel the craft comes from electricity. No, you can't make one entirely electric because space travel necessitates some kind of propellant because in order to move the rocket in one direction you need to throw an equal amount of energy in the opposite direction in the form of mass, and since electricity has little to no mass, you need to use that electricity to energize some kind of propellant.",2023-01-08 22:30:09,j3j19uh,t3_106ah0w,/r/WhitePeopleTwitter/comments/106ah0w/behold_my_friends_the_brightest_mind_to_ever/j3j19uh/,3,Positive
No-Magician-5081,"An ""electric rocket"" is basically what an ion engine is. 
Of course it still uses reaction mass, since we don't have real reactionless drives, still sci Fi, but then again, electric cars don't drive without wheels either.
Once more old Melon Husk demonstrates he's a jerk and an idiot.",2023-01-08 23:41:16,j3jc9bo,t3_106ah0w,/r/WhitePeopleTwitter/comments/106ah0w/behold_my_friends_the_brightest_mind_to_ever/j3jc9bo/,3,Negative
ThatOldBoomBap,Elon's about to call someone a pedo.,2023-01-08 23:50:00,j3jdlur,t3_106ah0w,/r/WhitePeopleTwitter/comments/106ah0w/behold_my_friends_the_brightest_mind_to_ever/j3jdlur/,3,Neutral
BoredBSEE,"FFS Elon.  I mean, honestly.  Don't you own a multibillion dollar company that makes rockets?

[https://en.wikipedia.org/wiki/Ion\_thruster](https://en.wikipedia.org/wiki/Ion_thruster)",2023-01-09 04:03:56,j3kduxb,t3_106ah0w,/r/WhitePeopleTwitter/comments/106ah0w/behold_my_friends_the_brightest_mind_to_ever/j3kduxb/,3,Positive
Fit_Cash8904,For those not familiar with Newton’s third law it’s as follows: “mehhh batteries are probably too heavy.”,2023-01-08 07:31:25,j3fyef3,t3_106ah0w,/r/WhitePeopleTwitter/comments/106ah0w/behold_my_friends_the_brightest_mind_to_ever/j3fyef3/,10,Negative
--marcel--,"this is what ChatGPT thinks about Elon's response:  


""The third law of Newton states that for every action, there is an equal and opposite reaction. This means that in order to produce motion in one direction, a force must be applied in the opposite direction. In a rocket, the forces acting on it are the thrust of the engine and the weight of the rocket itself. If a rocket were powered solely by an electric motor, the thrust that it could provide would be limited by the amount of energy that can be stored in batteries or accumulators. This means that an electric rocket would not have enough thrust to lift off from the surface of the earth, due to the force of gravity acting on it. Therefore, Elon Musk's response could be interpreted as ""No, due to the third law of Newton, an electric rocket would not have enough thrust to lift off.""",2023-01-08 15:35:46,j3h6ryl,t3_106ah0w,/r/WhitePeopleTwitter/comments/106ah0w/behold_my_friends_the_brightest_mind_to_ever/j3h6ryl/,5,Negative
gegeftw12,"A 51 years old man replying “Lol no”, truly the greatest man of our time",2023-01-08 12:40:38,j3gmlqp,t3_106ah0w,/r/WhitePeopleTwitter/comments/106ah0w/behold_my_friends_the_brightest_mind_to_ever/j3gmlqp/,8,Positive
Space-Dog1977,"Does he literally just spend all day scrolling through Twitter responding to randos? Jesus, what a tool.",2023-01-08 12:37:12,j3gmax3,t3_106ah0w,/r/WhitePeopleTwitter/comments/106ah0w/behold_my_friends_the_brightest_mind_to_ever/j3gmax3/,7,Neutral
EffectiveSwan8918,""" nope that's silly and impossible. Now behold, my ugly airbagless truck that can pull unlimited mass. Tired of low tide? Just pull the moon a little closer. Home team need a new stadium, just tow one from another city. We no longer need trains or 18 wheelers""",2023-01-08 12:58:54,j3go913,t3_106ah0w,/r/WhitePeopleTwitter/comments/106ah0w/behold_my_friends_the_brightest_mind_to_ever/j3go913/,5,Negative
Garlicluvr,We have a rare privilege here: seeing a rich dude obeying laws.,2023-01-08 15:04:36,j3h2h2z,t3_106ah0w,/r/WhitePeopleTwitter/comments/106ah0w/behold_my_friends_the_brightest_mind_to_ever/j3h2h2z/,4,Positive
Boxofbikeparts,"If anyone watches the show ""Avenue 5"" the character of Judd is based on Musk.",2023-01-08 15:11:13,j3h3d4f,t3_106ah0w,/r/WhitePeopleTwitter/comments/106ah0w/behold_my_friends_the_brightest_mind_to_ever/j3h3d4f/,4,Neutral
GenerikRedditUser,"Technically yes we have electric rockets, but I think Elon is aware of that and is addressing this from the layman’s view of a rocket, something to go from the ground to space, which isn’t feasible
(Not a fan of Elon but he’s not that stupid)",2023-01-08 18:55:37,j3i1y2p,t3_106ah0w,/r/WhitePeopleTwitter/comments/106ah0w/behold_my_friends_the_brightest_mind_to_ever/j3i1y2p/,6,Negative
Sight_Distance,"What am I missing? I thought the reason rocket propulsion works is because you are expelling mass, which creates the thrust. The 3rd law refers to that thrust (equal and opposite reaction from the expelled mass).

Unless the electric rocket is working by expelling mass, he should be correct. Is there some type of propulsion I’m not aware of? I don’t mean a fuel engine with electrical components, but a fully electronic engine powered by battery (not fuel) that would work in space.",2023-01-08 06:20:28,j3fs46j,t3_106ah0w,/r/WhitePeopleTwitter/comments/106ah0w/behold_my_friends_the_brightest_mind_to_ever/j3fs46j/,19,Negative
suk-my-ballz-0811,He is correct though…. You all hate this man so much you don’t think.,2023-01-08 09:02:08,j3g5nui,t3_106ah0w,/r/WhitePeopleTwitter/comments/106ah0w/behold_my_friends_the_brightest_mind_to_ever/j3g5nui/,24,Negative
sutterbutter,"Everyone seems to be missing that if you give him a little benefit of the doubt on what it means to be an electric rocket, then his answer makes sense. I would argue we should let him have that benefit of the doubt, as he is the sole founder of the most innovative rocket company to have ever existed. That company has directly outcompeted the likes of jeff bezos, who is by any measure a smart guy. Just saying, maybe elon knows a thing or 2 about rockets.",2023-01-08 09:32:50,j3g807i,t3_106ah0w,/r/WhitePeopleTwitter/comments/106ah0w/behold_my_friends_the_brightest_mind_to_ever/j3g807i/,17,Positive
andre3kthegiant,[SpinLaunch doesn’t work on magic pixie dust](https://earthsky.org/space/spinlaunch-slingshot-to-space/). They will likely succeed.,2023-01-08 06:48:24,j3fuq5w,t3_106ah0w,/r/WhitePeopleTwitter/comments/106ah0w/behold_my_friends_the_brightest_mind_to_ever/j3fuq5w/,7,Positive
EffingFergie,"The man is an INVESTOR, not a genius. Not even all that bright.",2023-01-08 10:40:50,j3gd3vv,t3_106ah0w,/r/WhitePeopleTwitter/comments/106ah0w/behold_my_friends_the_brightest_mind_to_ever/j3gd3vv/,6,Positive
Appropriate_Phase_28,"i think musk just got lucky with paypal and rest just got investors money

this is just stupid",2023-01-08 13:32:36,j3grjjx,t3_106ah0w,/r/WhitePeopleTwitter/comments/106ah0w/behold_my_friends_the_brightest_mind_to_ever/j3grjjx/,6,Negative
